hotel_id,place_id,display_name,formatted_address
che001,ChIJ4Uu1W21nUjoRQ2axHcnJyfI,"ITC Grand Chola, a Luxury Collection Hotel, Chennai","63, Mount Rd, Little Mount, Guindy, Chennai, Tamil Nadu 600032, India"
che002,ChIJj-bP-95nUjoRj2WldDKRWGY,The Leela Palace Chennai - Seaside Modern Palace Hotel,"Adyar Sea Face, Leela Palace Rd, MRC Nagar, Raja Annamalai Puram, Chennai, Tamil Nadu 600028, India"
che003,ChIJ_1NKffJnUjoR2_RDx0hAGDQ,The Madras Grand - Hotel Egmore,"1, Chinna St, Egmore, Chennai, Tamil Nadu 600008, India"
che004,ChIJPwzVz3JnUjoRenVEA9W6Kss,"Lemon Tree Hotel, Chennai","72, Sardar Patel Rd, Venkta Puram, Guindy, Chennai, Tamil Nadu 600032, India"
che005,ChIJpcUI-RdeUjoRRfKPvaNO8O4,"Trident, Chennai","1, 24, Grand Southern Trunk Rd, Kannan Colony, Meenambakkam, Chennai, Tamil Nadu 600027, India"
che006,ChIJg7w6CRRmUjoRLXhrkGmescI,"Radisson Blu Hotel, Chennai City Centre","2, .Ethiraj Salai, C-In, C Road, Egmore, Chennai, Tamil Nadu 600008, India"
che007,ChIJ89U7NT5mUjoRVHdkkpR0nfw,ibis Chennai City Centre,"690, Anna Salai, Mount Rd, Thousand Lights, Chennai, Tamil Nadu 600006, India"
che008,ChIJbW7Oxk1mUjoRFYylSVejkdk,Grand Chennai by GRT Hotels,"120, Sir Thyagaraya Rd, Drivers Colony, T. Nagar, Chennai, Tamil Nadu 600017, India"
che009,ChIJbyX3dWlmUjoR71fEKyBekdM,Radisson Blu Hotel & Suites GRT Chennai,"531, Grand Southern Trunk Rd, Parangi Malai, Palavanthangal, Chennai, Tamil Nadu 600016, India"
che010,ChIJmWoPFkFnUjoRI-GtrMXTAjY,Hablis - A Business Hotel In Chennal,"19, Grand Southern Trunk Rd, Ramapuram, Guindy, Chennai, Tamil Nadu 600032, India"
che011,ChIJJ8BNJVBnUjoR7W-fg3x1P8I,The Park Chennai,"601, Anna Salai, near US Embassy, Tirumurthy Nagar, Nungambakkam, Chennai, Tamil Nadu 600006, India"
che012,ChIJgVo7bEZmUjoR_YXqOhW4Nf4,Hyatt Regency Chennai,"365, Anna Salai, Sadras, Teynampet, Chennai, Tamil Nadu 600018, India"
che013,ChIJVVf9rz5nUjoRrVsT-8U6c3I,Hilton Chennai,"124, 1, Jawaharlal Nehru Salai, Poomagal Nagar, Guindy, Chennai, Tamil Nadu 600032, India"
che014,ChIJDYqGJBBdUjoRIlpn4iY5uaA,Holiday Inn Chennai Omr It Expressway by IHG,"110, Rajiv Gandhi Salai, PTK nagar, Thiruvanmiyur, Chennai, Tamil Nadu 600041, India"
che015,ChIJFYBioUNnUjoRQlBoq8IVdsM,UPAR Hotels Nungambakkam,"Ponnagipuram, Noor Veerasamy Ln, Nungambakkam, Chennai, Tamil Nadu 600034, India"
che016,ChIJTQ3LkhZmUjoRaWDuEENY7Hk,"Taj Connemara, Chennai","Binny Rd, Anna Salai, Chennai, Tamil Nadu 600002, India"
che017,ChIJ_VQjwl9aUjoRpELEnMekUeQ,ibis Chennai Sipcot,"ibis Chennai Sipcot, Rajiv Gandhi Salai, opp. Sipcot It Park, near state highway 49, Chennai, Egattur, Tamil Nadu 603103, India"
che018,ChIJLWWHQlNaUjoRjIqVQNVyooU,Ilara Hotels & Spa,"1A, 1B, Rajiv Gandhi Salai, OMR, Navalur, Chennai, Tamil Nadu 600130, India"
che019,ChIJncTcb_9mUjoR7hwcJOt4xxs,Hotel Taz Kamar Inn,"36, Rangan St, Postal Colony, T. Nagar, Chennai, Tamil Nadu 600017, India"
che020,ChIJtQsolkZmUjoR-L0W88Uj6kI,The Accord Metropolitan,"Just 2 kms away from US Embassy, 35, Gopathi Narayanaswami Chetty Rd, Lakshimi Colony, T. Nagar, Chennai, Tamil Nadu 600017, India"
che021,ChIJRxNWuxdmUjoRAMP9oon-tS0,"Taj Club House, Chennai","2, Club House Rd, near Bank of Baroda, Express Estate, Royapettah, Chennai, Tamil Nadu 600002, India"
che022,ChIJo_N9oE5nUjoRCXNoTX1KFoE,Pullman Chennai Anna Salai,"636, Anna Salai, Satya Murthy Nagar, Teynampet, Chennai, Tamil Nadu 600035, India"
che023,ChIJoY2RdEJmUjoRcfpd1MDkpMI,"Taj Coromandel, Chennai","37, Uthamar Gandhi Rd, near Makkal TV Office, Nungambakkam, Chennai, Tamil Nadu 600034, India"
che024,ChIJlaIomwJnUjoRgEL-6p-U854,Woodlands Inn,"No.2/2, New, CN Krishna Swamy Salai, opp. M. A. Chidambaram Cricket Stadium, Chepauk, Triplicane, Chennai, Tamil Nadu 600005, India"
che025,ChIJUwoxO3xcUjoR_HcOZVAQqPE,Novotel Chennai OMR,"It Expressway, opp. Elcot Sez, Sholinganallur, Chennai, Tamil Nadu 600119, India"
che026,ChIJO2Rd3nJnUjoRyT-oFDcwfVE,Park Hyatt Chennai,"39, Velachery Rd, near Raj Bhavan, Little Mount, Guindy, Chennai, Tamil Nadu 600032, India"
che027,ChIJc8uF1nVmUjoRbwUUWouzJuE,"The Pride Hotel, Chennai","216, E V R Periyar Salai, Poonamalle High Road, near Sangam Cinema, Kilpauk, Chennai, Tamil Nadu 600010, India"
che028,ChIJyxSMbfhmUjoR5ZL8sbniWf0,A.R Residency,"26, Ramachandra St, T. Nagar, Chennai, Tamil Nadu 600017, India"
che029,ChIJiauRQr9nUjoR-riZyrFPi3g,GRAND ONE TOWER,"3-2, Wallace Gdn 3rd St, Thousand Lights West, Thousand Lights, Chennai, Tamil Nadu 600006, India"
che030,ChIJlfDfL9xnUjoRaaa7wjp8-7w,Somerset Greenways Chennai,"94, Sathyadev Ave, MRC Nagar, Raja Annamalai Puram, Chennai, Tamil Nadu 600028, India"
che031,ChIJk8m2uatnUjoRD8C6LWXtjUY,THE K11 HOTELS - CHENNAI,"28, Sarojini St, near Saibaba Temple, T. Nagar, Chennai, Tamil Nadu 600017, India"
che032,ChIJORxanU9mUjoRzd81TtsnbqI,GT Grande Hotel-Near US Consulate & Singapore Consulate,"30, 2nd Street, N Boag Rd, near Singapore Consulate, Neelangarai, T. Nagar, Chennai, Tamil Nadu 600017, India"
che033,ChIJV14pcQlhUjoRtG2DE0cl6zU,M Stays,"2nd Floor, 98/99, Vanagaram-Ambattur Rd, Rajankuppam, Vanagaram, Chennai, Tamil Nadu 600095, India"
che034,ChIJG0-Y5MJnUjoR10M5uvomZPo,Kaira Park,"14/14A, CV Raman Rd, Natesan Colony, Alwarpet, Chennai, Tamil Nadu 600018, India"
che035,ChIJS-MFozdmUjoR_ZmiVXFISio,Welcomhotel By ITC Hotels - Cathedral Road,"Cathedral Rd, Parthasarathypuram, Teynampet, Chennai, Tamil Nadu 600086, India"
che036,ChIJgQ5o_7pnUjoR0PkpeXK2Xm4,S Hotels Chennai,"42, Thanikachalam Rd, T. Nagar, Chennai, Tamil Nadu 600017, India"
che037,ChIJt0tmy31cUjoR00VW91ujBOQ,ibis Chennai OMR,"It Expressway, opp. Elcot Sez, Sholinganallur, Chennai, Tamil Nadu 600119, India"
che038,ChIJs_4lSw1nUjoRlk1DsKns1i0,Ramada Plaza by Wyndham Chennai,"36, Sardar Patel Rd, Venkta Puram, Guindy, Chennai, Tamil Nadu 600032, India"
che039,ChIJEVOZCO5nUjoR0PWMqL02zxw,Stay Court (Business Class Hotel),"Old.No.06, New.No.08, Nabikhan, Shaik Ali Subedar St, Periamet, Poongavanapuram, Chennai, Tamil Nadu 600003, India"
che040,ChIJtwUoLRxmUjoRf4MBAzb9FLA,Royal Palace Hotel Marina Chennai,"NO 1, Tassuddin, Jani Jhan Khan Rd, near Adam Market, Police Quarters, Triplicane, Chennai, Tamil Nadu 600005, India"
che041,ChIJsX7Z5ihnUjoRP0sBsvDCk4s,Layalee Grande Hotel Chennai,"12A, Jawaharlal Nehru Salai, opp. Jaya TV Office, Thiru Vi Ka Industrial Estate, Ekkatuthangal, Chennai, Tamil Nadu 600034, India"
che042,ChIJ6S7-zRtlUjoRMgH1FTd2IFA,The Park Avenue Hotel,"nabi khan, Shaik Ali Subedar St, opposite to sheraton grande hotel, Periamet, periyamet, Chennai, Tamil Nadu 600003, India"
che043,ChIJmfqIrVZmUjoRRjRhGhTrlbI,UPAR Hotels T Nagar,"13, Gopalakrishna St, T. Nagar, Chennai, Tamil Nadu 600017, India"
che044,ChIJVX3ZHbJnUjoRSc3Z56QCng8,Novotel Chennai Chamiers Road,"City Centre, near Boat Club Road, &, Nandanam, Chennai, Tamil Nadu 600035, India"
che045,ChIJsQVdIcJmUjoRb7SYkLj2mMk,Hotel Greenpark Chennai,"N.S.K. Salai, Arcot Rd, Vadapalani, Chennai, Tamil Nadu 600026, India"
che046,ChIJ75YTQ3hvUjoRwYamlWzMCDY,Hotel AKMG Towers - Chennai,"7, 11, Stringer St, Edapalaiyam, Park Town, Chennai, Tamil Nadu 600003, India"
che047,ChIJx8fNjgdmUjoREyBqjHHBBcs,Super Hotel O Park Town Near Nehru Stadium,"hotel, 36/42, Thiruvengadam St, near Golden Tower, Periamet, Poongavanapuram, Chennai, Tamil Nadu 600003, India"
che048,ChIJ21FzxCVbUjoRC3Ymi_TbPgQ,Four Points by Sheraton Chennai OMR,"Survey, No 169 Plot 1B, Four Points 1, 1A, Rajiv Gandhi Salai, Kumaran Nagar, Sholinganallur, Chennai, Tamil Nadu 600119, India"
che049,ChIJHzRvhx9mUjoRx8j-nUz8-n8,Hotel Thaj Regency,"300, Triplicane High Rd, Padupakkam, Triplicane, Chennai, Tamil Nadu 600005, India"
che050,ChIJFRmpU0BmUjoRHcEpfntSByE,HOTEL CRYSTAL PARK,"51/22, Model School Rd, OPP. U.S CONSULATE, Thousand Lights West, Thousand Lights, Chennai, Tamil Nadu 600006, India"
che051,ChIJ_emzOxlvUjoRBQehURLotfI,Sun City Chennai,"16/1, Bommu chetty street, Edapalaiyam, George Town, Chennai, Tamil Nadu 600003, India"
che052,ChIJj6glq2hmUjoRWtToHiA3J-w,"Park Avenue Hotel, Chennai","No. 67, 84, Nungambakkam High Road, Block Z, Tirumurthy Nagar, Nungambakkam, Subba Road Avenue, Nungambakkam, Chennai, Tamil Nadu 600034, India"
che053,ChIJj6lvXtlgUjoR456qkQA5WYQ,"Lemon Tree Hotel, Shimona Chennai","31/3, Mount Poonamallee Rd, Parthasarathy Nagar, Manapakkam, Chennai, Tamil Nadu 600089, India"
che054,ChIJT0xM3RhhUjoRziO4nRaph3s,Palette - Hotel chennai le palace,"5/9, Arcot Rd, Karambakkam, Devi Nagar, Porur, Chennai, Tamil Nadu 600116, India"
che055,ChIJKWEPMjplUjoRsf32BRQ97E8,S R Residency,"39, 15, Raja Muthiah Rd, Periamet, Poongavanapuram, Chennai, Tamil Nadu 600003, India"
che056,ChIJoylFq2JnUjoRW-to1iAk30M,The Westin Chennai Velachery,"154, Velachery Rd, TN Police Housing Colony, Velachery, Chennai, Tamil Nadu 600042, India"
che057,ChIJw-__5WhmUjoRyhOvIEBwjDw,The Belstead Hotel,"103, Nungambakkam High Rd, Ponnangipuram, Subba Road Avenue, Nungambakkam, Chennai, Tamil Nadu 600034, India"
che058,ChIJ4e1MKFlbUjoRV_ZHG_xCFmI,Ginger Chennai OMR,"10, OMR, Toll plaza, Rajiv Gandhi Salai, Navalur, Tamil Nadu 600130, India"
che059,ChIJj0dLV_xlUjoRHZlEAli_3ww,Grand Cascade Hotels,"27/28, V.V. Kovil street Opp. Ripon building 03, Behind S.R Guest House, Periamet, Poongavanapuram, Chennai, Tamil Nadu 600003, India"
che060,ChIJbTQs2gpmUjoRgCkB-24dVzg,Hotel Rivera,"943, Poonamallee High Rd, Purasaiwakkam, Chennai, Tamil Nadu 600084, India"
che061,ChIJORylJphnUjoRgckMvNuGRrk,Grand Elegant,"21, VV Koil St, opp. Ripon Building, Periamet, Poongavanapuram, Chennai, Tamil Nadu 600003, India"
che062,ChIJ06nCDBdmUjoRYRYzik7OHpI,La Woods Hotel,"La Woods Hotel, 1, Woods Road, Anna Salai, Chennai, Tamil Nadu 600002, India"
che063,ChIJiwcC6JpmUjoRtqmj3MMcwlo,Blu Iris (Hot Plate),"37, Govinda St, Ayyavoo Colony, Aminjikarai, Chennai, Tamil Nadu 600030, India"
che064,ChIJh1RXCFdvUjoRHy24UHddEtA,Hotel White Park,"14, Kumarappa St, Periamet, Poongavanapuram, Chennai, Tamil Nadu 600003, India"
che065,ChIJgdeV3GtdUjoREsCcimb555w,Turyaa Chennai,"No 144 7, Rajiv Gandhi Salai, Elango Nagar, Perungudi, Chennai, Tamil Nadu 600096, India"
che066,ChIJH1i3CEZdUjoRuAhi5Dda53k,Eldoris Hotels Resorts,"No. 35, Kaveri Nagar Near Bella Ciao Waterland Drive Thiruvanmiyur, Valmiki Nagar, Kaveri Nagar, Kottivakkam, Chennai, Tamil Nadu 600041, India"
che067,ChIJVVVFE_xlUjoRQgS69pnR3sc,Hotel Metro Manor,"Gate No.4, Metro Manor, 97, Raja Muthiah Rd, opposite Nehru Stadium, Periyamedu, Choolai, Chennai, Tamil Nadu 600003, India"
che068,ChIJudduh3ZmUjoR3cPhhtS_ZRQ,Kings Hotel - Egmore,"32, Tamil Salai, Opposite Egmore Baby Hospital, Egmore, Chennai, Tamil Nadu 600008, India"
che069,ChIJRwohrT5mUjoRH56t0MjCq4I,Hotel Orchid Inns,"164, Peter's Rd, opposite to new college, Peters Colony, Royapettah, Chennai, Tamil Nadu 600014, India"
che070,ChIJnXpIrKBoUjoRfzw2p3jb7tM,GRAND VIEW RESIDENCY CHENNAI,"40/2 Venkatesan street, Wallahjah Rd, Chepauk, Triplicane, Chennai, Tamil Nadu 600005, India"
che071,ChIJ891ObXZnUjoRjPolQrp9P74,"Taj Wellington Mews, Chennai","X6RW+G74 TRIL Infopark Limited, Rajiv Gandhi IT Expy, near Ramanujan Intellion Park, Tharamani, Chennai, Tamil Nadu 600113, India"
che072,ChIJUWSb8E1mUjoR0oBe2fa7SW4,The Residency Towers Chennai,"115, Sir Thyagaraya Rd, T. Nagar, Chennai, Tamil Nadu 600017, India"
che073,ChIJe6F_z0FnUjoRPKTe9TrmPxA,Le Royal Méridien Chennai,"1, Grand Southern Trunk Rd, Ramapuram, Alandur, St.Thomas Mount, Chennai, Tamil Nadu 600016, India"
che074,ChIJ-4rSRk9mUjoRQywfC1tz3fM,Courtyard by Marriott Chennai,"564, Anna Salai, Teynampet, Thiru Vi Ka Kudiyiruppu, Teynampet, Chennai, Tamil Nadu 600018, India"
che075,ChIJr115ff1bUjoRIaibvgujaw4,Fairfield by Marriott Chennai OMR,"169 Rajiv Gandhi Salai, Old, Mahabalipuram Road, Semmancheri, Chennai, Tamil Nadu 600119, India"
che076,ChIJI9ERMH9cUjoRZ2j9oYJoShU,Citadines OMR Chennai,"Citadines Omr Chennai, OMR, Rajiv Gandhi Salai, Sholinganallur, Chennai, Tamil Nadu 600119, India"
che077,ChIJabidWVBmUjoR5CESNPTJfQA,"The Residency, Chennai","49, Gopathi Narayanaswami Chetty Rd, Lakshimi Colony, T. Nagar, Chennai, Tamil Nadu 600017, India"
che078,ChIJW_KwxV9aUjoRIZkqNMK3neM,Novotel Chennai Sipcot,"Old Mamallapuram Rd, opp. Sipcot It Park, near Ecr Beach, Siruseri, Chennai, Tamil Nadu 603103, India"
che079,ChIJ-Z5EYo9fUjoRIEoRjI1LC9M,Accord Chrome,"CLC Works Rd, Shankar Nagar, Chromepet, Chennai, Tamil Nadu 600044, India"
che080,ChIJi7Vf0DZmUjoRCqVAI3mblq0,Raj Park Hotel Chennai,"180, TT Krishnamachari Rd, Parthasarathypuram, Alwarpet, Chennai, Tamil Nadu 600018, India"
che081,ChIJC8LS49FgUjoRz_9htNXxm4E,Feathers A Radha Hotel,"4, 129, Mount Poonamallee Rd, Manapakkam, Chennai, Tamil Nadu 600089, India"
che082,ChIJCXNcmQhmUjoRruS7LuAUDbA,Ramada by Wyndham Chennai Egmore,"Gandhi Irwin Rd, Ansari Estate, Egmore, Chennai, Tamil Nadu 600008, India"
che083,ChIJfxUowZNaUjoRAsbUuQSqI58,MGM Beach Resorts,"Beside MGM Dizzee World, 1/74, SH 49, Muthukadu, Tamil Nadu 603112, India"
che084,ChIJMZ-uIWNkUjoR0leGSbHDybc,B8 Hotel,"8 AR Garden Road, 200 feet road, North, behind DRJ Hospital, Santhosh Nagar, Kolathur, Chennai, Tamil Nadu 600080, India"
che085,ChIJL2HywDBmUjoRg09f18xijo8,The Savera,"146, Dr Radha Krishnan Salai, Mylapore, Chennai, Tamil Nadu 600004, India"
che086,ChIJH_h6wv5cUjoR4sMquhX7-IA,Park Plaza Chennai OMR,"Rajiv Gandhi Salai, 142, OMR Service Rd, Mettukuppam, Thoraipakkam, Chennai, Tamil Nadu 600096, India"
che087,ChIJNSeUoNlnUjoRnam8beEBGuI,Bloom Hub | Guindy,"30, Anna Salai, near Hinduja Housing Finance, Guindy, Saidapet, Chennai, Tamil Nadu 600015, India"
che088,ChIJ53J1zJ5bUjoR38JwVUUCOuU,"Vivanta Chennai, IT Expressway","309, Rajiv Gandhi Salai, Elcot Sez, Sholinganallur, Chennai, Tamil Nadu 600119, India"
che089,ChIJmaL9QbZnUjoRdMVGbUgR1-o,"The Raintree, St Mary's Road","120, St Marys Rd, Austin Nagar, Alwarpet, Chennai, Tamil Nadu 600018, India"
che090,ChIJL6vaohxbUjoRE-gbWyklJKE,"Regenta Central RS, Chennai(OMR). 4 Star Hotel","13/ 1 A, near Navalur Toll, adjacent to Marina Mall, OMR, Egattur Village, Chennai, Egattur, Tamil Nadu 603103, India"
che091,ChIJiaZYCc5dUjoRROFP0qLxehM,"Zone by The Park Hotel, Chennai","430, Chennai Outer Ring Rd, near Kamakshi Hospital, S. Kolathur, S.Kolathur, Viduthalai Nagar, Kovilambakkam, Chennai, Tamil Nadu 600117, India"
che092,ChIJc6STqR5hUjoRLtrvNSfzLOA,Grand Residence,"No.85, 86, Arcot Rd, Karambakkam, Rajeswari Nagar, Porur, Chennai, Tamil Nadu 600116, India"
che093,ChIJL2v8mVBmUjoR40logksSLXk,Hotel Benzz Park,"62, Thirumalai Pillai Rd, T. Nagar, Chennai, Tamil Nadu 600017, India"
che094,ChIJy7jcsxNmUjoRqHfR-3WVvyU,Ambassador Pallava Chennai,"30, Red Cross Rd, Egmore, Chennai, Tamil Nadu 600008, India"
che095,ChIJT_cIeT1mUjoRvav0pm8ZtYs,E Hotel Chennai,"Gate No 1, Express Avenue Mall, Pattullos Rd, Express Estate, Royapettah, Chennai, Tamil Nadu 600014, India"
che096,ChIJccYzOGJnUjoRI8s9Qbgs73o,BOULEVARD by Design Hotel Chennai,"Phoenix Market City, 142, Velachery Rd, Indira Gandhi Nagar, Velachery, Chennai, Tamil Nadu 600042, India"
che097,ChIJrZVuOOpmUjoR_7j6QCwuzkA,Maple Tree Hotels,"77, Jawaharlal Nehru Salai, near City Union Bank, NGO Colony, Vadapalani, Chennai, Tamil Nadu 600026, India"
che098,ChIJ-0W-841QUjoRLrS0Avnk-CQ,Gokulam Park Sabari,"33, IT Expressway, Rajiv Gandhi Salai, Navalur, Tamil Nadu 600130, India"
che099,ChIJH9zbVxT2UjoRPRm3ZuJxJV4,Kalyan Grand - a business hotel,"247, Grand Southern Trunk Rd, Next to Vandalur Zoo, Chennai, Tamil Nadu 600048, India"
che100,ChIJKWhx-x1mUjoRxF_vcek-mcA,The King's Park Residency,"1. Arunachalam Street, Wallahjah Rd, opposite to KALAIVANAR ARANGAM, Chepauk, Triplicane, Chennai, Tamil Nadu 600005, India"
che101,ChIJUVMLs65dUjoRoaWgyoXjcVk,Hotel Halez,"102, SH 49A, Ezhil Nagar, Sholinganallur, Chennai, Tamil Nadu 600119, India"
che102,ChIJoUk6J2pmUjoRXwxXHvJMv0g,Palette - The Slate Hotel Nungambakkam,"23, 13, Khader Nawaz Khan Rd, Srirampuram, Thousand Lights West, Nungambakkam, Chennai, Poombukar Nagar, Tamil Nadu 600006, India"
che103,ChIJ8cV-ZxtmUjoREd1o_oTzEdA,Hotel Mallika | Budget Hotel in Chennai,"No: 14, Meeran Sahib St, Mount Road, Chintadripet, Chennai, Tamil Nadu 600002, India"
che104,ChIJP5CcAqFmUjoRCjeQ1pZvDkU,ANL RESIDENCY,"20 & 21, Thiruvengadam St, Periamet, Periyamet, Chennai, Tamil Nadu 600003, India"
che105,ChIJLTyJQBZnUjoRPWatakVgbhU,JJS PARK INN,"NO:29, Sarojini St, T. Nagar, Chennai, Tamil Nadu 600017, India"
che106,ChIJae5-QftlUjoRFwzW5-5DLxI,Sheraton Grande near Puratchi Thalaivar Dr MGR Central Railway Station at periamet,"1/1, Shaik Ali Subedar St, near Nehru Indoor Stadium, Periamet, Nabhikhan, Poongavanapuram, Chennai, Tamil Nadu 600003, India"
che107,ChIJHzRvhx9mUjoRGqXXmZpQrpE,Best Guest House,"No 18, Tassudin Khan Street, Near Adambakkam Market Bus Stop, Triplicane, Police Quarters, Triplicane, Chennai, Tamil Nadu 600005, India"
che108,ChIJKVgvUMBmUjoREFw_sP4Qxnk,Hotel Pandian,"15, Kennet Ln, Egmore, Chennai, Tamil Nadu 600008, India"
che109,ChIJ7zxO68tnUjoRN1C8RSVisZ4,Supreme Stay - Hotel Chepauk,"21, CN Krishnasamy Street, Police Quarters, Triplicane, Chennai, Tamil Nadu 600005, India"
che110,ChIJVVVVhf1lUjoRMdte6xyWDVs,BHIMAS INN,"110, Walltax Road, Opposite Railway Parcel Office, Central, Edapalaiyam, Park Town, Chennai, Tamil Nadu 600003, India"
che111,ChIJvbgzx9RlUjoRVY-dmHtG1WA,Hotel Sand Silver,"52, Raja Muthiah Rd, Periamet, Periyamedu, Park Town, Chennai, Tamil Nadu 600012, India"
che112,ChIJ0xPcmQdmUjoRGviZsgFA2Z0,The Greens- Rooms on main road Near Chennai Central Railway Station,"NH 48, 74/76, Poonamallee High Rd, Next To Golden Tower, Periamet, Poongavanapuram, Chennai, Tamil Nadu 600003, India"
che113,ChIJo0qxmRdnUjoRqrqV8sdY13U,The Hydel Park ( Business Class Hotel),"12, VV Koil St, Periamet, Park Town, Chennai, Tamil Nadu 600003, India"
che114,ChIJoboUjJ9nUjoR_Tg5o2PJsIE,Hotel Joyce,"38 & 39, Thiruvengadam St, Periamet, Poongavanapuram, Chennai, Tamil Nadu 600003, India"
che115,ChIJe1hnJBBnUjoRWIDUsp9Vmpw,Hotel Greens Gate,"12, Metro Entrance, 13, VV Koil St, adjacent to Ripon Building, Periamet, Poongavanapuram, Chennai, Tamil Nadu 600003, India"
che116,ChIJrQ0iev9lUjoRmMZ75qweYTI,Samudra Residency chennai,"3&5, Bommu Street, Edapalaiyam, Park Town, Chennai, Tamil Nadu 600003, India"
che117,ChIJlTnJmY9nUjoRJpiBXCNnP_Q,HOTEL ROYAL PARK - Chennai,"Tamil Nadu Electricity Board Head Office, Link Rd, Anna Salai, Triplicane, Chennai, Tamil Nadu 600002, India"
che118,ChIJR1yvzONnUjoR2DKwB7BWdew,"SKM Regency. Chennai, Periyamet","6, Patnool Sandusa Street, Periamet, Poongavanapuram, Chennai, Tamil Nadu 600003, India"
che119,ChIJSQFDysJlUjoR5Qh94nrWqdA,Hotel Park Tower,"13/5, Perianna Maistry St, Periamet, Park Town, Chennai, Tamil Nadu 600003, India"
che120,ChIJk8zzU-plUjoRM6WH1IxcgJI,Sarovar Inn,"166, 1/2, Wall Tax Rd, Periamet, Jutkapuram, Chennai, Tamil Nadu 600003, India"
che121,ChIJXam7zmpmUjoRJSMxySIKVOM,Angson Serviced Apartments,"Greams Rd, Thousand Lights West, Thousand Lights, Chennai, Tamil Nadu 600006, India"
che122,ChIJz9DTlaBoUjoRxKGNckroTmk,Hotel New Regency,"2, CN Krishna Swamy Salai, Chepauk, Triplicane, Chennai, Tamil Nadu 600005, India"
che123,ChIJn6iefFNnUjoR_nQ7zOe_C6s,Le Grace Annasalai,"570, Anna Salai, opposite AG-DMS, Teynampet, Thiru Vi Ka Kudiyiruppu, Teynampet, Chennai, Tamil Nadu 600018, India"
che124,ChIJoewdsk9vUjoRaUnU8mVQs-E,SM MANSION near Harbour & Madras High Court,"Old No 73 New No 151, Mannady, Angappa Naicken Street, Parrys, Mannadi, George Town, Chennai, Tamil Nadu 600001, India"
che125,ChIJBUHo0x1mUjoR3GHGB19fBCE,Charminar Residency,"10, Tassudin Khan Street, Ellis Puram, Police Quarters, Triplicane, Chennai, Tamil Nadu 600005, India"
che126,ChIJvaWPbfhcUjoROBKpJx7y23Y,"Venture Park, OMR, Thoraipakkam, Chennai","4/410, 4/410, Rajiv Gandhi Salai, Chandrasekhar Avenue, Thoraipakkam, Chennai, Tamil Nadu 600097, India"
che127,ChIJ79pxsQ9mUjoR4bCPtsc9sfg,Hotel Safra(Lodging),"Pudupet, Anna Salai, aditanar, Chennai, Tamil Nadu 600002, India"
che128,ChIJbSzLFdRfUjoRY0kARIDmXDE,Royal Green Accommodation Chennai Airport,"13, Dr Ambedkar Salai, behind Chennai Airport. Land mark: City Union Bank, Nehru Nagar, Pozhichalur, Chennai, Tamil Nadu 600074, India"
che129,ChIJSRsxwR9mUjoRRMfhI2Kf9v0,Peace Inn,"164/60, Big St, Chepauk, Triplicane, Chennai, Tamil Nadu 600005, India"
che130,ChIJIzGwuP1lUjoRpacdWD3ASFk,Hotel Srm Central Park,"No15, Kumarappa St, Periamet, Poongavanapuram, Chennai, Tamil Nadu 600003, India"
che131,ChIJgU150AZfUjoRCQk7O9Hy95E,THE CHENNAI INN,"1, 200 Feet Radial Rd, near Near latha super bazaar, zamin, Pallavaram, Chennai, Tamil Nadu 600117, India"
che132,ChIJnRbLQQdmUjoRjjp-c9nI18k,Aum Karthikeya Residency,"1119, Poonamallee High Rd, Periamet, Poongavanapuram, Chennai, Tamil Nadu 600003, India"
che133,ChIJcdDkh1xnUjoRIpRh45XWqF8,Hotel AK International - Chennai,"29/14 cuddappa, rangaiah Street, opposite Kauvery hotel, Periamet, Poongavanapuram, Chennai, Tamil Nadu 600003, India"
che134,ChIJVbjcpFNnUjoRdJBGuZJLs5U,RR MOUNT ELITE SUITES,"New No.10 Old No, 120, Thiru. Vika. Rd, Thiru-vi-ka-Salai, Anna Salai, Triplicane, Chennai, Tamil Nadu 600002, India"
che135,ChIJvcHTlgdmUjoRSMdYPGP-jpY,Hotel O Golden Tower,"78, Poonamallee High Rd, Anna Nagar, Anna Nagar West, Periyamet, Chennai, Tamil Nadu 600003, India"
che136,ChIJx8fNjgdmUjoRqUr5bxTdyWM,Hotel Shriram,"23, Thiruvengadam St, Periamet, Poongavanapuram, Chennai, Tamil Nadu 600003, India"
che137,ChIJPZ0gwRNmUjoR7ji2kuhV3wg,Mount Residency Near LIC metro,"NO:4, Arumugam St, Anna Salai, Chennai, Tamil Nadu 600002, India"
che138,ChIJYbMRPwlmUjoRcsXVqYaHKN8,Hotel Chennai Gate,"Old No 17 & 18,19 New No.37,39,41, Gandhi Irwin Road, Railway, opposite Egmore, opposite Chennai, Egmore, Chennai, Tamil Nadu 600008, India"
che139,ChIJpT97-h5mUjoRv27K0x8YXXg,Broad Lands,"no.18, Vallaba Agraharam St, SVM Nagar, Padupakkam, Triplicane, Chennai, Tamil Nadu 600005, India"
che140,ChIJ7fd4L7BnUjoRlREltlTB9vk,Hotel Sunpark Inn Poongavanapuram,"No 18 cuddappa, rangiah street, Periamet, Poongavanapuram, Chennai, Tamil Nadu 600003, India"
che141,ChIJ2QPruqplUjoRnlwzVkNV-vs,Hotel O 4 Seasonz Residency,"16/39, Thiruvengadam St, Periamet, Poongavanapuram, Chennai, Tamil Nadu 600003, India"
che142,ChIJn1cwkQdmUjoRRXyMzSy3_zI,Hotel Delmon Residency,"37,Thiruvengadam street, Poonamallee High Rd, Periamet, Poongavanapuram, Chennai, Tamil Nadu 600003, India"
che143,ChIJu079dFVlUjoRmtmh38EHR0M,Hotel Zain Grande,"New No.55, Old No, 59, Raja Muthiah Rd, near Central Railway Station, opposite Nehru Indoor Stadium, Periamet, Poongavanapuram, Chennai, Tamil Nadu 600003, India"
che144,ChIJkXKNE6BnUjoROZLkCSFtDk4,Gulnaar inn Near Apollo Hospital,"11 N 25:27, Aziz Muluk 3rd St, Thousand Lights West, Thousand Lights, Chennai, Tamil Nadu 600006, India"
che145,ChIJrbC-WhtmUjoRzuZll9rM0Pg,The Mount Regency,"7, Wallers Rd, Mount Road, Chintadripet, Chennai, Tamil Nadu 600002, India"
che146,ChIJocmw5_1lUjoR0lXlIEgW-NM,"Hotel White Mount, Rama Pillai Street, Periyamet, Chennai, Tamil Nadu","5, Rama Pillai St, near चेन्नई, Periamet, Poongavanapuram, Chennai, Tamil Nadu 600003, India"
che147,ChIJfQIl6v1lUjoR0AjempQCPN8,Orion Residency,"Rama Pillai St, Periamet, Poongavanapuram, Chennai, Tamil Nadu 600003, India"
che148,ChIJ65XS_YtnUjoRCjwRoRqyw54,Zidan Hotel rooms,"Chennai Central, 37JC+G64, Periamet, Poongavanapuram, Chennai, Tamil Nadu 600003, India"
che149,ChIJBZ59xS9nUjoRakuSrB-30cc,JS Grand Residency,"Central Railway Station, 22, Poonamallee High Rd, near Chennai, Periamet, Adikesavarpuram, Poongavanapuram, Chennai, Tamil Nadu 600003, India"
che150,ChIJZ9_EGBRmUjoREuaKS1orwJ0,Vestin Park Hotel,"39, Red Cross Rd, Egmore, Chennai, Tamil Nadu 600008, India"
