hotel_id,city,display_name,latitude,longitude,formatted_address,hospitals_count_1km,pharmacies_count_1km,shopping_count_1km,restaurants_count_1km,banks_count_1km,parks_count_1km,fuel_stations_count_2_5km,ev_charging_count_2_5km,entertainment_count_2_5km,transport_hubs_count_2_5km,walkability_score,shopping_score,restaurant_score,bank_score,green_space_score,hospital_score,pharmacy_score,entertainment_score,locality_score
ahm001,Ahmedabad,"Taj Skyline, Ahmedabad",23.0441549,72.48227729999999,"Taj Skyline Ahmedabad, Sankalp Square III, Opp. Saket 3, Sindhubhavan Road, nr. Neelkanth Green, PRL Colony, Thaltej, Shilaj, Ahmedabad, Gujarat 380059, India",0,0,0,1,0,0,1,0,0,1,0,0,4,0,0,0,0,0,5
ahm002,Ahmedabad,"ITC Narmada, a Luxury Collection Hotel, Ahmedabad",23.0296101,72.530075,"Survey # 104 A, Judges Bunglow Rd, I I M, Vastrapur, Ahmedabad, Gujarat 380015, India",27,0,2,3,1,0,1,0,4,8,30,25,12,10,0,100,0,80,55
ahm003,Ahmedabad,"Radisson Blu Hotel, Ahmedabad",23.0235616,72.5570168,"Near Panchvati Cross Roads, Chimanlal Girdharlal Rd, Ambawadi, Ahmedabad, Gujarat 380006, India",28,0,2,13,0,0,5,0,1,22,36,25,52,0,0,100,0,20,100
ahm004,Ahmedabad,"Welcomhotel By ITC Hotels, Ashram Road, Ahmedabad",23.0526254,72.5716833,"15, Ashram Road, Dandi Kuch Cir, Old Wadaj, Ahmedabad, Gujarat 380013, India",20,0,0,0,0,0,3,0,1,30,20,0,0,0,0,100,0,20,100
ahm005,Ahmedabad,Four Points by Sheraton Ahmedabad,23.0224261,72.5676799,"opposite Gujarat College, Ellisbridge, Ahmedabad, Gujarat 380006, India",27,0,0,3,0,1,8,0,1,29,22,0,12,0,20,100,0,20,100
ahm006,Ahmedabad,Novotel Ahmedabad,23.0239972,72.5072893,"Iscon Cross Roads, Sarkhej - Gandhinagar Hwy, next to Wide Angle Cinema, Ramdev Nagar, Ahmedabad, Gujarat 380015, India",3,0,1,7,1,2,2,0,2,1,22,12,28,10,40,60,0,40,31
ahm007,Ahmedabad,DoubleTree by Hilton Ahmedabad,23.0282074,72.50164629999999,"Ambli Rd, Vikram Nagar, Ahmedabad, Gujarat 380058, India",0,0,1,9,1,1,2,0,2,0,11,12,36,10,20,0,0,40,23
ahm008,Ahmedabad,Hyatt Regency Ahmedabad,23.0436557,72.5703442,"17/A, Ashram Rd, Usmanpura, Ahmedabad, Gujarat 380014, India",40,0,0,3,2,0,3,0,0,33,25,0,12,20,0,100,0,0,100
ahm009,Ahmedabad,Hyatt Ahmedabad,23.039463599999998,72.5305022,"next to Alpha One Mall, Vastrapur, Ahmedabad, Gujarat 380015, India",29,0,3,7,1,1,1,0,2,11,36,37,28,10,20,100,0,40,67
ahm010,Ahmedabad,Hotel Elysian Residency,23.0441447,72.58965830000001,"Hotel Elysian Residency, Opp Reliance Mall Near Namaste Circle(BAPS Circle, Road, Jain Colony, Shahibag, Ahmedabad, Gujarat 380004, India",11,0,1,0,1,0,3,0,0,35,24,12,0,10,0,100,0,0,100
ahm011,Ahmedabad,Pride Plaza Hotel Ahmedabad,23.0381549,72.5145022,"Judges Bungalow Rd, off Sarkhej - Gandhinagar Highway, Bodakdev, Ahmedabad, Gujarat 380054, India",6,0,1,11,1,0,1,0,4,10,33,12,44,10,0,100,0,80,65
ahm012,Ahmedabad,"Lemon Tree Premier, The Atrium, Ahmedabad",23.028933000000002,72.57693139999999,"Off Nehru Bridge, Sabarmati, Flat-c, Jasmine Flat, Riverfront Rd, opp. Lemon tree Hotel, Old City, Towards, Khanpur, Ahmedabad, Gujarat 380001, India",16,0,0,10,3,2,7,0,1,32,32,0,40,30,40,100,0,20,100
ahm013,Ahmedabad,Regenta Central Antarim Hotel,23.0331714,72.5568904,"Between, Girish Coldrink and Xaviers Corner, Chimanlal Girdharlal Rd, Vasant Vihar, Navrangpura, Ahmedabad, Gujarat 380006, India",20,0,1,18,3,0,4,0,0,25,41,12,72,30,0,100,0,0,100
ahm014,Ahmedabad,Hotel Cosmopolitan,23.0397407,72.56051719999999,"Darshan Society, Road, near Stadium Circle, Swastik Society, Navrangpura, Ahmedabad, Gujarat 380009, India",43,0,0,15,4,0,2,0,0,28,38,0,60,40,0,100,0,0,100
ahm015,Ahmedabad,THE HILLOCK AHMEDABAD,23.133669400000002,72.5669654,"THE HILLOCK AHMEDABAD, Opp. The CBD, 200 ft, Ring Road, nr. Vaishnodevi Circle, Ahmedabad, Gujarat 382421, India",0,0,0,0,0,0,0,0,0,0,0,0,0,0,0,0,0,0,0
ahm016,Ahmedabad,Crowne Plaza Ahmedabad City Centre,23.0146335,72.504128,"Sarkhej - Gandhinagar Hwy, near Shapath V, Prahlad Nagar, Ahmedabad, Gujarat 380015, India",2,0,0,7,1,1,2,0,2,1,15,0,28,10,20,40,0,40,25
ahm017,Ahmedabad,Renaissance Ahmedabad Hotel,23.07526,72.5267243,"Behind Ganesh Meridian Complex, Sola Road, Sarkhej - Gandhinagar Hwy, Vishwas City 1, Sola, Ahmedabad, Gujarat 380060, India",2,0,0,0,0,0,1,0,1,2,8,0,0,0,0,40,0,20,14
ahm018,Ahmedabad,Hotel The Westend,23.0218059,72.5679669,"Hotel Westend, Gujarat College Rd, Ellisbridge, Ahmedabad, Gujarat 380006, India",28,0,0,3,0,1,8,0,1,29,22,0,12,0,20,100,0,20,100
ahm019,Ahmedabad,The Grand Bhagwati,23.042414599999997,72.51466479999999,"Plot No 380, NH 8C, Sarkhej - Gandhinagar Hwy, opp. Gurudwara, Bodakdev, Ahmedabad, Gujarat 380054, India",6,0,0,6,0,0,1,0,4,11,24,0,24,0,0,100,0,80,60
ahm020,Ahmedabad,Fairfield by Marriott Ahmedabad,23.0520233,72.5710493,"Ashram Rd, Satyawadi Society, Usmanpura, Ahmedabad, Gujarat 380013, India",21,0,0,0,0,0,3,0,1,30,20,0,0,0,0,100,0,20,100
ahm021,Ahmedabad,Hotel Royal Comfort,23.079014800000003,72.5954156,"Shell Petrol Pump, Pushti Sparsh Arcade, 308-320, B/S, opp. to Rathi Apartment, Dharm Nagar II, Sabarmati, Ahmedabad, Gujarat 380005, India",16,0,1,2,3,0,0,0,2,24,29,12,8,30,0,100,0,40,92
ahm022,Ahmedabad,Palette River Front formerly Host Inn,23.0292213,72.57757219999999,"hotel, Nehru Brg, opposite BMC Bank, Old City, Corner, Khanpur, Ahmedabad, Gujarat 380001, India",18,0,0,10,3,2,7,0,1,31,32,0,40,30,40,100,0,20,100
ahm023,Ahmedabad,"Lemon Tree Hotel, Ahmedabad",23.0296816,72.5640165,"434/1, Mithakali Six, Cross Rd, Maharashtra Society, Navrangpura, Ahmedabad, Gujarat 380006, India",18,0,0,19,3,0,5,0,1,32,39,0,76,30,0,100,0,20,100
ahm024,Ahmedabad,Hotel City Inn,23.0264825,72.5822049,"Seema Chambers, Relief Rd, opp. Electricity House, Old City, Gheekanta, Lal Darwaja, Ahmedabad, Gujarat 380001, India",13,0,0,11,3,2,7,0,1,35,33,0,44,30,40,100,0,20,100
ahm025,Ahmedabad,"Fortune Select SG Highway, Ahmedabad - Member ITC Hotels’ Group",23.0644295,72.5222848,"Sarkhej - Gandhinagar Hwy, near Palladium Mall, Ghatlodiya, Ahmedabad, Gujarat 380054, India",7,0,1,0,0,0,1,0,3,10,23,12,0,0,0,100,0,60,52
ahm026,Ahmedabad,Cambay Grand Ahmedabad,23.0589646,72.5231565,"Gulab Tower Rd, Near PERD Centre, Thaltej, Ahmedabad, Gujarat 380054, India",7,0,1,0,0,0,1,0,3,10,23,12,0,0,0,100,0,60,52
ahm027,Ahmedabad,Centra Hotel,23.0316254,72.57736779999999,"Hotel Centra, Bhilwas, Khanpur, Ahmedabad, Gujarat 380001, India",24,0,0,10,3,1,6,0,1,31,32,0,40,30,20,100,0,20,100
ahm028,Ahmedabad,HOTEL NALANDA,23.0305468,72.5640671,"Mithakhali Six Rd, Maharashtra Society, Ellisbridge, Ahmedabad, Gujarat 380006, India",20,0,0,18,3,0,5,0,1,32,38,0,72,30,0,100,0,20,100
ahm029,Ahmedabad,"Fortune Park, Ahmedabad - Member ITC hotels' group",23.023836499999998,72.566914,"Opp Gujarat College, Purshottam Mavlankar Marg, Ellisbridge, Ahmedabad, Gujarat 380006, India",27,0,0,6,0,0,7,0,1,33,24,0,24,0,0,100,0,20,100
ahm030,Ahmedabad,Fortune Landmark Ahmedabad - Member ITC Hotels' Group,23.0478105,72.5705122,"Ashram Rd, Shanti Nagar, Usmanpura, Ahmedabad, Gujarat 380013, India",29,0,0,1,1,0,3,0,1,32,22,0,4,10,0,100,0,20,100
ahm031,Ahmedabad,Aarya Grand Hotels & Resorts,23.0755288,72.5225608,"Kargil Petrol Pump Lane, Vrundavan Party Plot Rd, near Gujarat High Court, Sola, Ahmedabad, Gujarat 380060, India",3,0,0,0,0,0,1,0,1,2,12,0,0,0,0,60,0,20,15
ahm032,Ahmedabad,Hotel Riverview,23.027022499999998,72.5720901,"Nehru Brg, near Sakar VII, Vishalpur, Ellisbridge, Ahmedabad, Gujarat 380009, India",15,0,0,6,2,1,6,0,1,31,27,0,24,20,20,100,0,20,100
ahm033,Ahmedabad,Hotel Paris Plaza,23.0921439,72.52847059999999,"H-202, S G BUSINESS HUB, Sarkhej - Gandhinagar Hwy, nr. Sola, bhagwat, Gota, Ahmedabad, Gujarat 382470, India",0,1,0,0,0,0,1,0,0,2,2,0,0,0,0,0,12,0,8
ahm034,Ahmedabad,"Vivanta Ahmedabad, SG Highway",23.086648399999998,72.5289313,"147, 53, Sarkhej - Gandhinagar Hwy, opposite Bhagwat Vidhya Peeth, Sola, Ahmedabad, Gujarat 380061, India",2,1,0,0,0,0,1,0,1,2,10,0,0,0,0,40,12,20,15
ahm035,Ahmedabad,The Cama - A Sabarmati Riverfront Hotel,23.032004399999998,72.57690939999999,"2HJG+FPF, Mahaveer Marg, Old City, Khanpur, Ahmedabad, Gujarat 380001, India",24,0,0,7,3,0,6,0,1,30,30,0,28,30,0,100,0,20,100
ahm036,Ahmedabad,Hotel Rajdeep Inn - Deluxe & Super Deluxe Rooms Booking In Ahmedabad | Corporate Accommodation,23.0122169,72.5136445,"Shell Petrol Pump, Near, 100 Feet Anand Nagar Rd, Prahlad Nagar, Ahmedabad, Gujarat 380015, India",7,0,0,5,1,1,2,0,3,5,25,0,20,10,20,100,0,60,43
ahm037,Ahmedabad,SilverCloud Hotel & Banquets,23.0586609,72.5778958,"726 & 727 opp Gandhi Ashram & Dandi Bridge, 3H5H+F3J, Ashram Rd, opp. gandhi ashram and dandi bridge, Hridaya Kunj, Old Wadaj, Ahmedabad, Gujarat 380027, India",10,0,0,2,0,0,3,0,1,33,21,0,8,0,0,100,0,20,100
ahm038,Ahmedabad,Hotel Silver Heights,23.032085,72.564538,"Mithakhali Cir, Nr. Passport Office, Mithakhali, Navrangpura, Ahmedabad, Gujarat 380009, India",26,0,0,18,4,0,5,0,1,30,40,0,72,40,0,100,0,20,100
ahm039,Ahmedabad,Hotel Noble Inn,23.026709999999998,72.5819357,"Hanuman Gali, Relief Rd, opp. to Electric City house, Old City, Gheekanta, Lal Darwaja, Ahmedabad, Gujarat 380001, India",11,0,0,11,3,2,7,0,1,35,33,0,44,30,40,100,0,20,100
ahm040,Ahmedabad,The Ummed Ahmedabad,23.082569200000002,72.61672829999999,"The Ummed, Airport Cir, Sardarnagar, Hansol, Ahmedabad, Gujarat 382475, India",1,0,0,0,0,1,0,0,0,4,4,0,0,0,20,20,0,0,15
ahm041,Ahmedabad,Binori A Boutique Hotel,23.0538119,72.51799749999999,"Thaltej Cross Roads, Sarkhej - Gandhinagar Hwy, Bhaikakanagar, Thaltej, Ahmedabad, Gujarat 380054, India",5,0,1,0,0,0,1,0,3,10,23,12,0,0,0,100,0,60,52
ahm042,Ahmedabad,Hotel New York,22.966678299999998,72.58849,"3rd Floor, 3rd Floor, Narayan Arcade, Bus Stop, near, Shahwadi Rd, opp. Gokulesh Petrol Pump, Narolgam, Ahmedabad, Gujarat 382405, India",8,0,0,0,0,0,0,0,0,0,20,0,0,0,0,100,0,0,8
ahm043,Ahmedabad,Hotel The Crown,23.1103553,72.6741648,"320 3Rd Floor Atlanta Business Hub Nana Chiloda Circle, Sardar Patel Ring Rd, GIDC Naroda, Ahmedabad, Gujarat 382330, India",0,0,0,3,0,0,0,0,0,0,2,0,12,0,0,0,0,0,2
ahm044,Ahmedabad,HOTEL THE PACIFIC,23.082348399999997,72.620351,"Ashram Shooping Center, opp. Dr. C.G English School, Sardarnagar, Hansol, Ahmedabad, Gujarat 382475, India",2,0,0,0,1,1,0,0,1,4,9,0,0,10,20,40,0,20,20
ahm045,Ahmedabad,HOTEL PLENTEOUS INN ( ROOMS & BANQUET ),23.0258868,72.5694614,"plenteous inn, opp. Gandhigram railway station, Ellisbridge, Ahmedabad, Gujarat 380009, India",12,0,0,3,0,0,7,0,1,33,22,0,12,0,0,100,0,20,100
ahm046,Ahmedabad,Grand Mercure Ahmedabad GIFT City,23.163604799999998,72.6853533,"Grand Mercure, Gujarat International Finance Tec-City, Techcity, Gujarat 382050, India",0,0,0,0,0,0,1,0,0,3,0,0,0,0,0,0,0,0,11
ahm047,Ahmedabad,Ramada by Wyndham Ahmedabad,23.010696799999998,72.5048563,"SG Highway, Corporate Rd, Near, Prahlad Nagar, Ahmedabad, Gujarat 380015, India",0,0,0,6,1,1,1,0,2,1,6,0,24,10,20,0,0,40,19
ahm048,Ahmedabad,Treatotel Hotel,23.0495153,72.5315493,"TREATOTEL HOTEL, Sterling Hospital, Sterling Hospital Rd, L.K Society, Nilmani Society, Memnagar, Ahmedabad, Gujarat 380052, India",31,0,2,2,2,0,0,0,3,11,30,25,8,20,0,100,0,60,58
ahm049,Ahmedabad,Hotel Prime,23.0268458,72.58609419999999,"2nd Floor,Vishal Commercial Centre, Relief Rd, opposite LIC Building, Patthar Kuva, Bhadra, Ahmedabad, Gujarat 380001, India",15,0,0,12,3,3,4,0,1,36,34,0,48,30,60,100,0,20,100
ahm050,Ahmedabad,BloomSuites | Ahmedabad,23.051392699999997,72.5251124,"34, Surdhara Rd, opp. Kolkata Kulture, Nilmani Society, Thaltej, Ahmedabad, Gujarat 380054, India",22,0,3,2,2,0,1,0,3,12,33,37,8,20,0,100,0,60,66
ahm051,Ahmedabad,Hotel Carrefour,23.0253376,72.5668142,"Gujarat College Rd, near Nagri Eye Hospital, Ellisbridge, Ahmedabad, Gujarat 380006, India",23,0,0,6,0,0,6,0,1,33,24,0,24,0,0,100,0,20,100
ahm052,Ahmedabad,"Rivera Sarovar Portico, Ahmedabad",23.033467599999998,72.5764772,"Bhavan’s College Road Sabarmati Riverfront, Mahaveer Marg, Old City, Khanpur, Ahmedabad, Gujarat 380001, India",24,0,0,4,4,0,4,0,0,31,29,0,16,40,0,100,0,0,100
ahm053,Ahmedabad,The President A Boutique Hotel,23.0353066,72.5601904,"Chimanlal Girdharlal Rd, Opp. Municipal Market, Vasant Vihar, Navrangpura, Ahmedabad, Gujarat 380009, India",31,0,0,17,4,0,4,0,0,30,39,0,68,40,0,100,0,0,100
ahm054,Ahmedabad,Wyndham Ahmedabad Shela,23.005701,72.454071,"Club O7 Rd, off Sardar Patel Ring Road, Shela, Gujarat 380057, India",0,0,0,0,1,0,0,0,0,0,1,0,0,10,0,0,0,0,0
ahm055,Ahmedabad,Narayani Heights,23.1119177,72.62925489999999,"Airport, Ahmedabad - Gandhinagar Rd, adjacent APOLLO HOSPITAL, GIDC Bhat, Bhat, Ahmedabad, Gandhinagar, Gujarat 382428, India",0,0,0,1,0,0,1,0,0,13,0,0,4,0,0,0,0,0,41
ahm056,Ahmedabad,Hotel Eldorado,23.032693,72.56591399999999,"Mithakhali Six roads, o, Netaji Rd, Opposite Shri Krishna Centre Adani Wilmar House lane, Mithakhali, Navrangpura, Ahmedabad, Gujarat 380009, India",25,0,0,17,4,0,5,0,1,30,39,0,68,40,0,100,0,20,100
ahm057,Ahmedabad,Ginger Ahmedabad (Vastrapur),23.047448499999998,72.53075989999999,"Drive In Rd, behind Himalaya Mall Commercial Building Big Bazar, Nilmani Society, Memnagar, Ahmedabad, Gujarat 380015, India",31,0,3,5,2,1,1,0,3,14,36,37,20,20,20,100,0,60,77
ahm058,Ahmedabad,Artilla Inn (Hotel - Conference -Banquet),23.022184199999998,72.5719467,"At, Swami Vivekananda Pool, opposite Town Hall, Ellisbridge, Ahmedabad, Gujarat 380006, India",14,0,0,1,1,2,7,0,1,27,22,0,4,10,40,100,0,20,100
ahm059,Ahmedabad,Hotel Maple Leaf,23.0336769,72.4634117,"4th Floor, TRP Mall, Bhagwatikrupa Society, Bopal, Ahmedabad, Gujarat 380058, India",4,0,1,1,1,0,1,0,0,1,21,12,4,10,0,80,0,0,15
ahm060,Ahmedabad,"Keys Select by Lemon Tree Hotels, Gandhi Ashram, Ahmedabad",23.0633627,72.5818798,"Ashram Rd, Hridaya Kunj, Old Wadaj, Ahmedabad, Gujarat 380027, India",3,0,4,4,2,0,1,0,1,27,30,50,16,20,0,60,0,20,100
ahm061,Ahmedabad,"Hotel Suncity - Best hotel in Ahmedabad, Best Hotels & Luxury Hotel in Ashram road, Best Hotel in Ashram Road",23.023996699999998,72.5711129,"2nd Flr, Devnandan Mega Mall, 7016441888, Ashram Rd, opp. Sanyas Ashram, nr. MJ Library, Ellisbridge, Ahmedabad, Gujarat 380009, India",16,0,0,2,1,2,7,0,1,27,23,0,8,10,40,100,0,20,100
ahm062,Ahmedabad,Radhe Upavan Resort,22.934865799999997,72.67839699999999,"Jashoda Mehmdabad Highway, Hathijan, Ahmedabad, Badodara, Gujarat 382445, India",0,0,0,0,0,0,0,0,0,0,0,0,0,0,0,0,0,0,0
ahm063,Ahmedabad,Hotel Royal Grand,23.0332044,72.55875139999999,"A 103 Samudra Complex, 1st Floor, Nr.Classic Gold Hotel girish cold drink cross road, uper saffron Restaurant, Chimanlal Girdharlal Rd, Vasant Vihar, Navrangpura, Ahmedabad, Gujarat 380006, India",21,0,1,19,3,0,4,0,0,31,42,12,76,30,0,100,0,0,100
ahm064,Ahmedabad,"Hotel The Lotus Park Ellisbridge, Paldi, Ahmedabad",23.017370699999997,72.56724559999999,"Ellish bridge, opp. Kothawala, Pritam Nagar, Paldi, Ahmedabad, Gujarat 380006, India",38,0,0,5,2,1,7,0,1,22,27,0,20,20,20,100,0,20,98
ahm065,Ahmedabad,"Hotel Pinnacle, Ahmedabad",23.0220372,72.570893,"Ashram Rd, Opp Town Hall, Madalpur Gam, Ellisbridge, Ahmedabad, Gujarat 380006, India",18,0,0,1,1,2,7,0,1,29,22,0,4,10,40,100,0,20,100
ahm066,Ahmedabad,APRICOT HOTEL,23.0233416,72.5682509,"Orient Club - Plot No.578/2,Kavi Nanalal Marg, Railway Crossing, near Gujarat College, Ellisbridge, Ahmedabad, Gujarat 380007, India",24,0,0,3,0,1,7,0,1,31,22,0,12,0,20,100,0,20,100
ahm067,Ahmedabad,Hotel The Grand Suites,23.0266153,72.5695389,"4th Floor, Mohini-2, opp. Gandhigram Metro Station, Ellisbridge, Ahmedabad, Gujarat 380009, India",15,0,0,3,0,0,6,0,1,31,22,0,12,0,0,100,0,20,100
ahm068,Ahmedabad,WelcomHeritage Mani Mansion,23.0152778,72.5644666,"Shantikunj, Near, Paldi Cross Roads, behind Mehdi Nawaz Jung Hall, Pritam Nagar, Paldi, Ahmedabad, Gujarat 380006, India",47,0,0,4,2,1,7,0,1,19,26,0,16,20,20,100,0,20,88
ahm069,Ahmedabad,Hotel Pleasant Lake,23.003218699999998,72.59788209999999,"Rambaug Kankariya Rd, opposite Gopikrishna Complex, Kankaria, Maninagar, Ahmedabad, Gujarat 380028, India",33,0,0,1,1,1,1,0,0,17,22,0,4,10,20,100,0,0,64
ahm070,Ahmedabad,Super Inn Armoise Hotel,23.03757,72.56643230000002,"Swastik Cross Rd, near Chimanlal Girdharlal Road, opp. SARDAR PATEL STADIUM, Navarangpura Gam, Navrangpura, Ahmedabad, Gujarat 380009, India",33,0,0,15,5,0,3,0,0,35,39,0,60,50,0,100,0,0,100
ahm071,Ahmedabad,Hotel Lake Point,23.0053529,72.605226,"Kankaria Lake Gate. 5, opp. Balvatika, Kankaria, Maninagar, Ahmedabad, Gujarat 380008, India",34,0,0,1,0,1,1,0,0,20,20,0,4,0,20,100,0,0,72
ahm072,Ahmedabad,Tribecca Select,23.1179563,72.6248549,"Shree Balaji Agora Mall Rd, Sughad, Ahmedabad, Gujarat 382421, India",0,0,0,1,0,0,1,0,0,12,0,0,4,0,0,0,0,0,38
ahm073,Ahmedabad,HOTEL AHMEDABAD INN,23.0270926,72.58647979999999,"Karnavati Arcade, 4, Relief Rd, Old City, Gheekanta, Bhadra, Ahmedabad, Gujarat 380001, India",16,0,0,12,3,2,4,0,1,36,34,0,48,30,40,100,0,20,100
ahm074,Ahmedabad,Hotel Radiant,23.013613199999998,72.5649403,"Paldi cross road, Paldi Rd, opposite Amts Bus Stop, opposite Adani CNG PUMP, Paldi Gaam, Paldi, Ahmedabad, Gujarat 380007, India",45,0,0,4,3,1,7,0,1,14,27,0,16,30,20,100,0,20,74
ahm075,Ahmedabad,Hotel Surya Villas by Srurban Hotels Pvt Ltd,23.041029599999998,72.5520943,"3rd Floor, Sanskar Complex, Metro Station, Drive In Rd, near Commerce Six Road, Roop Nagar, Sarvottam Nagar Society, Navrangpura, Ahmedabad, Gujarat 380009, India",21,1,0,15,4,0,1,0,1,23,40,0,60,40,0,100,12,20,99
ahm076,Ahmedabad,APRICOT HOTEL,23.1098428,72.60510219999999,"GRAND EMPORIO, Motera, Ahmedabad, Gujarat 380005, India",3,0,0,1,0,0,0,0,2,16,12,0,4,0,0,60,0,40,59
ahm077,Ahmedabad,Hotel Fun Regency,23.1103442,72.6060318,"2nd Floor, S-Mall, Narendra Modi Stadium Road, near H.P. Petrol Pump, Motera, Ahmedabad, Gujarat 380005, India",2,0,0,1,0,0,0,0,2,16,8,0,4,0,0,40,0,40,57
ahm078,Ahmedabad,Hotel Neelkanth Palace,23.015833,72.593539,"Opposite Avkar Guest House, Near S T Bus St, Geeta mandir, Kankaria, Ahmedabad, Gujarat 380022, India",13,0,2,3,1,1,2,0,1,22,30,25,12,10,20,100,0,20,92
ahm079,Ahmedabad,Hotel Rudra Mahal,23.024836900000004,72.57182920000001,"Capital Commercial Center, Ashram Rd, near Sanyas Ashram, opp. LIC Office, Ellisbridge, Ahmedabad, Gujarat 380009, India",13,0,0,3,2,2,7,0,1,29,25,0,12,20,40,100,0,20,100
ahm080,Ahmedabad,The House of MG,23.0273596,72.5818316,"Bhadra Rd, Opp. Sidi, Old City, Gheekanta, Lal Darwaja, Ahmedabad, Gujarat 380001, India",12,0,0,11,3,2,6,0,1,37,33,0,44,30,40,100,0,20,100
ahm081,Ahmedabad,jüSTa Diwans Bungalow,23.017760199999998,72.581467,"1785, Saiyad Wadu, MB Kadri Road, Raikhad II, Opposite Gaikwad Haveli, Old City, Dudhabhai ni Chali, Raikhad, Ahmedabad, Gujarat 380001, India",6,0,0,8,2,3,6,0,1,30,29,0,32,20,60,100,0,20,100
ahm082,Ahmedabad,"Bhavan Road, Thaltej",23.041743399999998,72.50554079999999,"2GR4+M6V, Sindhubhavan Rd, Thaltej, Ahmedabad, Gujarat 380059, India",1,0,0,10,0,0,1,0,3,9,12,0,40,0,0,20,0,60,48
ahm083,Ahmedabad,Gulmohar Greens Golf & Country Club Limited,22.961210599999998,72.4297692,"Off Sarkhej, Kolat - Telav Rd, Next to Gokul-Vrindavan, Sanand, Gujarat 382210, India",0,0,0,1,0,0,0,0,0,0,0,0,4,0,0,0,0,0,0
ahm084,Ahmedabad,Ramada by Wyndham Ahmedabad Narendra Modi Stadium Motera,23.0951901,72.59954309999999,"3HWX+4RC GCA Club, Narendra Modi Stadium, Motera, Ahmedabad, Gujarat 380005, India",5,0,1,5,0,0,0,0,2,26,27,12,20,0,0,100,0,40,99
ahm085,Ahmedabad,"HOTEL REGENTA INN RANIP - AHMEDABAD, BY ROYAL ORCHID HOTELS .",23.0685197,72.5761161,"ARVED TRANSCUBE PLAZA, 3H9G+CC5 THE FAMILY MALL, 132 Feet Ring Rd, opp. Adi-Jati Girls Hostel, Bandhu Nagar, Vijay Nagar, Ranip, Ahmedabad, Gujarat 382480, India",6,0,4,4,4,0,2,0,1,25,41,50,16,40,0,100,0,20,100
ahm086,Ahmedabad,"Ebony Residency, Ahmedabad",23.0453373,72.513296,"Sarkhej - Gandhinagar Hwy, Behind Apex Heart Institute, Near Gurudwara, West End Park, Thaltej, Ahmedabad, Gujarat 380059, India",6,0,0,4,0,0,1,0,4,11,23,0,16,0,0,100,0,80,58
ahm087,Ahmedabad,The Metropole Hotel(unit of Majestic Projects Pvt. Ltd.),23.0652693,72.5840581,"Subhash Bridge, near RTO Circle, Keshav Nagar, Ahmedabad, Gujarat 380027, India",3,0,4,4,2,0,1,0,1,29,30,50,16,20,0,60,0,20,100
ahm088,Ahmedabad,Biznotel by Pride Motera,23.0971481,72.59713649999999,"Motera Stadium Rd, next to Radiance Residency, Motera, Ahmedabad, Gujarat 380005, India",8,0,1,5,0,0,0,0,2,25,27,12,20,0,0,100,0,40,96
ahm089,Ahmedabad,Eulogia Inn,23.1084498,72.5374183,"Gota Bridge Eulogia Hotel Road, 4G5P+9XF, Vivaan Rd, opp. Safal, beside Prime Status, Gota, Ahmedabad, Gujarat 382481, India",1,0,0,1,0,0,0,0,0,0,4,0,4,0,0,20,0,0,2
ahm090,Ahmedabad,YMCA International Centre | Club in Ahmedabad,23.0048156,72.50143249999999,"2G52+364, Sarkhej - Gandhinagar Hwy, Makarba, Ahmedabad, Gujarat 380015, India",0,0,0,3,0,1,1,0,1,1,2,0,12,0,20,0,0,20,12
ahm091,Ahmedabad,"Regenta Inn , Ranip Hotel & Banquet",23.0685929,72.5764216,"OPP -ADDI JATTI GIRLS HOSTEL, ARVED TRANSCUBE PLAZA, 132 Feet Ring Rd, behind D'mart, Bandhu Nagar, Vijay Nagar, Ranip, Ahmedabad, Gujarat 382480, India",4,0,4,4,4,0,2,0,1,28,37,50,16,40,0,80,0,20,100
ahm092,Ahmedabad,Prasang Presidency,23.0852006,72.5344047,"R.C.T.I College Road, Prasang Residency, Prasang Party Plot Rd, opposite C-3, Unique City Homes, Ghatlodiya, Chanakyapuri, Ahmedabad, Gujarat 380061, India",2,1,0,0,0,0,1,0,1,2,10,0,0,0,0,40,12,20,15
ahm093,Ahmedabad,Townhouse Netaji Road,23.0149521,72.5641137,"141 67, Netaji Road, Cross Road, nr. Paldi, Paldi, Ahmedabad, Gujarat 380006, India",48,0,0,4,2,1,7,0,1,14,26,0,16,20,20,100,0,20,73
ahm094,Ahmedabad,Hotel German Palace,23.110780899999998,72.6313405,"Ahmedabad - Gandhinagar Rd, Opposite Apollo Hospital, Bhat, Ahmedabad, Gujarat 382428, India",0,0,0,1,0,0,1,0,0,13,0,0,4,0,0,0,0,0,41
ahm095,Ahmedabad,Hotel Skyland,22.9956906,72.6661029,"XMW8+7CH, Vastral, Ahmedabad, Gujarat 382418, India",3,0,0,1,0,0,0,0,0,6,12,0,4,0,0,60,0,0,23
ahm096,Ahmedabad,Hotel Airport Residency,23.0815616,72.61711729999999,"Subhash Bridge, Sardarnagar, Hansol, Ahmedabad, Gujarat 382475, India",1,0,0,0,1,1,0,0,1,4,5,0,0,10,20,20,0,20,19
ahm097,Ahmedabad,OYO Flagship Hotel Raj,23.0192579,72.599239,"3rd Floor, D/304, Ghantakarn Mahaveer Market, Sarangpur, Sherkotda, Ahmedabad, Gujarat 380002, India",9,0,2,3,1,1,3,0,0,24,30,25,12,10,20,100,0,0,97
ahm098,Ahmedabad,Hotel Madhav,23.020177699999998,72.5579284,"2nd Floor, Dev Complex, opp. Mercedes Show Room, near Parimal Garden, Ambawadi, Ahmedabad, Gujarat 380006, India",37,0,2,13,1,0,5,0,1,23,38,25,52,10,0,100,0,20,100
ahm099,Ahmedabad,Hotel jay Balaji,22.9637685,72.5912678,"4th Floor, Free Way Trade Center, Narol-Aslali Highway, Narol, Narolgam, Ahmedabad, Gujarat 382405, India",7,0,0,0,0,0,0,0,0,0,20,0,0,0,0,100,0,0,8
ahm100,Ahmedabad,OYO 1480 Hotel Centra,23.0334659,72.5758705,"Riverfront Rd, Old City, Khanpur, Ahmedabad, Gujarat 380001, India",25,0,0,4,3,0,4,0,0,32,27,0,16,30,0,100,0,0,100
ahm101,Ahmedabad,Hotel Citizen,23.0706869,72.5217237,"3GCC+7MH, Science City Rd, above Co-Operative Bank, Sola, Ahmedabad, Gujarat 380060, India",2,0,0,0,0,0,1,0,2,5,8,0,0,0,0,40,0,40,26
ahm102,Ahmedabad,Hotel Uttam nivas,23.027634,72.597246,"Revdi Bazar , Releif Road, 2772, Relief Rd, Old City, Tankshal, Khadia, Ahmedabad, Gujarat 380001, India",16,0,0,3,0,1,4,0,0,26,22,0,12,0,20,100,0,0,98
ahm103,Ahmedabad,Hotel Kinara,23.0264262,72.5862922,"S.B.Tower, Near gheekanta Cross Road Behind Pir Mohammad Shah Road, Relief Rd, Patthar Kuva, Bhadra, Ahmedabad, Gujarat 380001, India",15,0,0,12,3,3,4,0,1,35,34,0,48,30,60,100,0,20,100
ahm104,Ahmedabad,Hotel O Jamalpur Ahmedabad Formerly Hotel Peace,23.0100434,72.5798001,"hotel peace Ashrafi Complex, opposite SARDAR Patel MARKET, Calico Mills, Jamalpur, Ahmedabad, Gujarat 380022, India",5,0,0,1,0,1,6,0,1,15,20,0,4,0,20,100,0,20,70
ahm105,Ahmedabad,Hotel Volga,23.0266964,72.5821612,"Relief Rd, near Ankelsharia Hospital, opp. Electricity House, Old City, Gheekanta, Lal Darwaja, Ahmedabad, Gujarat 380001, India",13,0,0,11,3,2,7,0,1,35,33,0,44,30,40,100,0,20,100
ahm106,Ahmedabad,SRTC Hotel Aspire,23.0483245,72.5713079,"Near Usmanpura, opp fortune landmark, Ashram Rd, Usmanpura, Ahmedabad, Gujarat 380009, India",23,0,0,1,1,0,3,0,1,33,22,0,4,10,0,100,0,20,100
ahm107,Ahmedabad,HOTEL NEW YORK,23.092759599999997,72.68625229999999,"6th floor, Newyork Empire, circle, Sardar Patel Ring Rd, near Dehgam Ring road, Naroda, Ahmedabad, Gujarat 382330, India",0,0,0,2,0,0,2,0,0,0,1,0,8,0,0,0,0,0,5
ahm108,Ahmedabad,Hotel Heritage,23.0128515,72.5636238,"cross Road, near Adani CNG Pump, near Longlife Hospital, Paldi, Ahmedabad, Gujarat 380007, India",50,0,0,4,3,0,6,0,1,13,27,0,16,30,0,100,0,20,67
ahm109,Ahmedabad,Balaji Hotel Law Garden CG Road Ahmedabad,23.029127199999998,72.55954899999999,"5th floor balaji paragon opp. axis bank nr. law garden, Chimanlal Girdharlal Rd, Opposite Axis Bank Branch, Ellisbridge, Ahmedabad, Gujarat 380006, India",9,0,1,22,3,0,4,0,1,31,45,12,88,30,0,100,0,20,100
ahm110,Ahmedabad,Hotel Riverfront,23.0125783,72.5680094,"Bhagatachyarya road, opposite Museum, Nr. NID, Paldi, Ahmedabad, Gujarat 380007, India",30,0,0,3,3,1,7,0,1,14,26,0,12,30,20,100,0,20,73
ahm111,Ahmedabad,"Ginger Ahmedabad, RTO Circle",23.067930699999998,72.5810072,"132ft Ring Road, RTO Cir, Sastri Nagar, Hridaya Kunj, Old Wadaj, Ahmedabad, Gujarat 380027, India",3,0,4,4,3,0,1,0,1,29,32,50,16,30,0,60,0,20,100
ahm112,Ahmedabad,Hotel Shital Inn,23.0365312,72.5267947,"9/C, Lad Society Rd, opposite Sardar Center, Vastrapur, Ahmedabad, Gujarat 380015, India",19,0,1,6,0,1,1,0,5,9,27,12,24,0,20,100,0,100,62
ahm113,Ahmedabad,Alba Premier Ahmedabad,23.0461943,72.534335,"Opp Gurukul Towers, Drive In Rd, Sushil Nagar Society, Memnagar, Ahmedabad, Gujarat 380052, India",35,0,2,5,2,1,0,0,3,11,33,25,20,20,20,100,0,60,63
ahm114,Ahmedabad,Marshall The Hotel,23.029853199999998,72.5991758,"Station Road, near Moti Bakery, Kapasia Bazar, Sakar Bazzar, Kalupur, Ahmedabad, Gujarat 380002, India",14,0,0,2,0,1,4,0,0,26,21,0,8,0,20,100,0,0,97
