hotel_id,place_id,display_name,formatted_address
jai001,ChIJAQAAAJS2bTkRWUWQ2VmlhSA,Hotel Rajasthan Palace,"Rajasthan Palace Hotel, 3, Peelwa Garden, Moti Doongari Road, Anand Puri, Bees Dukan, Adarsh Nagar, Jaipur, Rajasthan 302004, India"
jai002,ChIJX2_Rbgu0bTkR-wPc1ueFLpA,"Jai Mahal Palace, Jaipur","Gound Floor, Jacob Rd, near Bharat Petroleum, Civil Lines, Jaipur, Rajasthan 302006, India"
jai003,ChIJ-b0CTxO0bTkRDLjMSGGz5_Y,Ginger Jaipur,"Mangalam GeejGarh House, Hawa Sadak, Sudarshanpura, Civil Lines, Jaipur, Rajasthan 302006, India"
jai004,ChIJQfQ-_bK2bTkRZjSwp4vttPk,Jaipur Hotel New - A heritage hotel,"7, Chaura Rasta Rd, opposite GOLCHA CINEMA, Nehru Bazar, Film Colony, Modikhana, Jaipur, Rajasthan 302003, India"
jai005,ChIJrayiYVizbTkRNxKLOs7XAso,Hotel Maru Casa Jaipur | Budget 3 Star Hotels in Jaipur City Centre,"Sansar Chandra Rd, near Polo Victory, behind Man Singh Hotel, Sindhi Camp, Jaipur, Rajasthan 302001, India"
jai006,ChIJV2013gm0bTkRRCUYohwps7I,"HOTEL ABHINEET PALACE, FAMILY HOTEL NEAR JAIPUR RAILWAY STATION","Fateh Singh Market, Railway station, B-9, behind Kalpana Bus Agency, opp. Exit gate 3, Gopalbari, Jaipur, Rajasthan 302006, India"
jai007,ChIJ5WlPPwm0bTkRHRLayfAgpis,Luxsugero Jaipur,"WQ7R+F99, Ajmer Rd, Gopalbari, Jaipur, Rajasthan 302019, India"
jai008,ChIJpbW77wy0bTkR88adhFeXxD4,"Hotel Shahar Palace - Best Budget Hotels in Civil Lines, Jaipur","Barwara House Colony, Ajmer Rd, Madrampur, Civil Lines, Jaipur, Rajasthan 302006, India"
jai009,ChIJmdOcate3bTkRYLfD_DoFOtA,Rosé Amer,"7, Sawai Pratapsingh Rd, Madrampur, Civil Lines, Jaipur, Rajasthan 302006, India"
jai010,ChIJP8-cJPi0bTkRqivQpmXCs6g,Renest Jaipur,"Gopalpura Bypass Rd, near Ganga Jamuna Petrol Pump, New Aatish Market, Shanthi Nagar, Mansarovar, Jaipur, Rajasthan 302020, India"
jai011,ChIJ922iwRS0bTkRdOphwwLdqcQ,RANI MAHAL,"Plot No: 24, Lane Number 3, Hawa Sadak, Nandpuri Colony, Bais Godam, Jaipur, Rajasthan 302006, India"
jai012,ChIJheAS8fezbTkRsJzHAXq_4CA,Radisson Hotel Jaipur City Center,"Khasa Kothi Circle, Mirza Ismail Rd, Gopalbari, Jaipur, Rajasthan 302001, India"
jai013,ChIJVVVVFQ-0bTkRU7L0SnU1rRo,"The Sunder Palace, A Luxury Boutique Hotel.","Near Ajmer Road, Plot No. 46, Sanjay Marg, Gopalbari, Jaipur, Rajasthan 302001, India"
jai014,ChIJdQ_9-WizbTkR6TxNflQiRsM,Hotel Pulse Inn Jaipur,"Exit No-1, A14, opposite Railway Station, Sen Colony, Gopalbari, Jaipur, Rajasthan 302006, India"
jai015,ChIJDVLPcwC0bTkRurw0zLGu6Ag,Jai Niwas Hotel,"3, Jalupura Scheme, Gopinath Marg, Mirza Ismail Rd, Jalupura, Jaipur, Rajasthan 302001, India"
jai016,ChIJg_FmfEa1bTkRM2PbM5R-f7Q,The Royal Hermitage - Best Luxury Hotel Jaipur,"Main Building, Barwara House, 5, Jacob Rd, beside IndusInd Bank, Madrampur, Civil Lines, Jaipur, Rajasthan 302006, India"
jai017,ChIJKTkkrd2zbTkRSVn56RVd6eY,Hotel Rimé Vista,"D-249, Devi Marg, Sen Colony, Bani Park, Jaipur, Rajasthan 302016, India"
jai018,ChIJXz2K1Qm0bTkR9EbcaX6o_cg,Hotel Ankur Palace,"Plot No 4, Fateh Singh Market, opp. Rajputana Sheraton, near Railway Station, Gopalbari, Jaipur, Rajasthan 302006, India"
jai019,ChIJjbdFcVGxbTkRHpVdJUKRIYs,Jaipur View,"2177, Raja Shiv Das Ji Ka Rasta, Gangori Bazar, Brahampuri, Jaipur, Rajasthan 302001, India"
jai020,ChIJ5Z7eegy0bTkRi9zVvG_Uhc8,Barwara Kothi,"5, Jacob Rd, beside Indus-Ind Bank, Madrampur, Civil Lines, Jaipur, Rajasthan 302006, India"
jai021,ChIJ5w_4AfGzbTkRQtcJSYEZtVw,Umaid Bhawan-A Royal Heritage Style Boutique Hotel,"D1-2A, Via Bank Road, behind Collectorate, Meera Marg, Bani Park, Jaipur, Rajasthan 302016, India"
jai022,ChIJd9YlF-azbTkRL5TBZfM9fSk,Hotel Sarang Palace - Boutique Stays & Candlelight Dining,"A- 40, Subhash Nagar Rd, Near Peetal Factory, Subash Nagar, Shastri Nagar, Jaipur, Rajasthan 302016, India"
jai023,ChIJDXa4Q_KzbTkRxVGrrvNf9wI,Shahpura House,"D-257, Devi Marg, Bani Park, Jaipur, Rajasthan 302016, India"
jai024,ChIJDRQnopu1bTkRsaSwmKsD4o4,Jaipur Bungalow,"F-264, Priyadarshini Marg, Shyam Nagar, Jaipur, Rajasthan 302019, India"
jai025,ChIJAQAAQA20bTkR0TRBKYxhBng,Hari Mahal Palace by Pachar Group,"Tirthraj, Jacob Road, Civil Lines, Madrampur, Civil Lines, Jaipur, Rajasthan 302006, India"
jai026,ChIJIdNAHlCzbTkRqKRFV5Qdd0g,Nirbana Palace - A Heritage Hotel,"Main D-Villa Building, Khasa Kothi Circle, Mirza Ismail Rd, behind Hotel Teej, Chanakyapuri, Kanti Nagar, Bani Park, Jaipur, Rajasthan 302001, India"
jai027,ChIJwUW6QxO0bTkRed5s3HVhiGw,Hilton Jaipur,"42, Geejgarh House, Hawa Sadak, Geejgarh Vihar Colony, Bais Godam, Jaipur, Rajasthan 302006, India"
jai028,ChIJ7Uepzv6zbTkRZZ88WC5sw8k,Fort Chandragupt,"Station Rd, Near Near Central Bus Stand, Kanti Nagar, Sindhi Camp, Jaipur, Rajasthan 302001, India"
jai029,ChIJ48leTnK0bTkR1jT92zRYZFY,ibis Jaipur City Centre,"Ajmer Rd, near Civil Lines Metro Station, Area, Civil Lines, Jaipur, Rajasthan 302006, India"
jai030,ChIJTXGwxbS1bTkR4Tv-9fN5Efk,"Sawai Man Mahal, Jaipur","Bhawani Singh Rd, near Hyundai Showroom, Rambagh, Jaipur, Rajasthan 302015, India"
jai031,ChIJHR2J1gG0bTkR5yNhhQvmZbw,Comfort Inn Sapphire,"C, 5, Mirza Ismail Rd, near Panchbatti, Jayanti Market, New Colony, Jaipur, Rajasthan 302001, India"
jai032,ChIJ9x__8u-3bTkRwey8of6uxlA,Hotel Indo Prime,"C-14, Mirza Ismail Rd, Jayanti Market, New Colony, Jaipur, Rajasthan 302001, India"
jai033,ChIJjYvmZAa0bTkReAi9f9Jlszo,Chirmi Palace - A Heritage Home (estd. 1884) - A Unit of Giggle Stays,"Dhuleshwar Garden, off Sardar Patel Marg, behind Kotak Mahindra Bank, Panch Batti, C Scheme, Jaipur, Rajasthan 302001, India"
jai034,ChIJtcSlteazbTkRGWa-m95mAcE,Hotel Raghuraj Palace,"A-4, Shastri Nagar Rd, near Goyal Hospital, Hazi Colony, Shastri Nagar, Jaipur, Rajasthan 302016, India"
jai035,ChIJ7RlVqwm0bTkRZISybPIzj7s,Pearl Palace Heritage,"54, Gopalbari Lane 2, Gopalbari, Jaipur, Rajasthan 302001, India"
jai036,ChIJB6S9Xc6zbTkRP22NZqYKB24,"The County Inn | Vaishali Nagar, Jaipur","285, Vaishali Marg, Hanuman Nagar, Vaishali Nagar, Jaipur, Rajasthan 302021, India"
jai037,ChIJ4S5HIPKzbTkRVzj8nVIZeqo,Umaid Mahal-A heritage Style Boutique Hotel,"C, BUILDING, 20 / B-2, Bihari Marg, opp. Lane of K.P. Automotives, Sen Colony, Bani Park, Jaipur, Rajasthan 302016, India"
jai038,ChIJp78bJAK0bTkR3SvRy_yeV-M,Royal Orchid Central Jaipur,"No. A-26, A, 2, Sawai Jai Singh Hwy, Kanti Nagar, Bani Park, Jaipur, Rajasthan 302016, India"
jai039,ChIJY6Q-ZG60bTkRIZrQ5oiG_cM,"PALM 34 ""A Luxury Stay"" Homestay, Jaipur","PALM34, 34, Shiv Path, Suraj Nagar West, Civil Lines, Jaipur, Rajasthan 302006, India"
jai040,ChIJgYyKxrG2bTkRnDKXr-S9Czk,"The Wall Street Beacon Hotel, Jaipur","Circle, C-7, Mirza Ismail Rd, near Panch Batti, Jayanti Market, New Colony, Jaipur, Rajasthan 302001, India"
jai041,ChIJvX2Di_izbTkRu2CoKhEWetk,Treebo Natraj - Hotel in Jaipur,"Motilal Atal Rd, Sindhi Camp, Jaipur, Rajasthan 302001, India"
jai042,ChIJvfhrXu2zbTkR9qfgzs_OxQo,Om Niwas Suite Hotel,"E - 23, Kaushalya Path, Durga Marg, Subash Nagar, Sen Colony, Bani Park, Jaipur, Rajasthan 302001, India"
jai043,ChIJSX5PkkGzbTkRFbPeg-I6Pq4,Hotel Sumaditya,"A-16B, Sikar Rd, opposite Bhawani Niketan, Ambabari, Vidyadhar Nagar, Jaipur, Rajasthan 302039, India"
jai044,ChIJjYIWJ06xbTkRrLnEm1IZX8s,Hotel Wind Palace,"meters away from, Jorawar Singh Gate, 100, Amer Rd, opp. Ridhi Sidhi textiles, Govind Nagar West, Brahampuri, Jaipur, Rajasthan 302002, India"
jai045,ChIJOfdngF21bTkReaKe88xZU2w,Flute Boutique By Hotel 91,"Chomu House, circle, D-81, Shiv Heera Path, Panch Batti, C Scheme, Jaipur, Rajasthan 302001, India"
jai046,ChIJTznWTIS0bTkRmrK07ddnvzg,"Avana Hotel, Jaipur","Queens Road, Gandhi Path, opposite Vijay Dwar, Nityanand Nagar, Vaishali Nagar, Jaipur, Rajasthan 302021, India"
jai047,ChIJCWQZrmizbTkRfZPPexa5bOI,Karni Vilas,"Kabir Marg, Sen Colony, Bani Park, Jaipur, Rajasthan 302016, India"
jai048,ChIJoUtGIvyzbTkR3igkGORNrXA,Hotel Blue Heaven BY Gazebo,"Plot Number A 399, Main, Pareek College Rd, Kanti Nagar, Bani Park, Jaipur, Rajasthan 302006, India"
jai049,ChIJbWDr4AizbTkR0A3xHXuoZX4,Hotel The Royal Cm-Bani Park,"Indra Colony, Bani Park, Jaipur, Rajasthan 302006, India"
jai050,ChIJ1Ze4b_6zbTkRuQay3Ye0jm8,Hotel Gandharva - A Green Hotel,"Reserve Police Line, Sindhi Camp, Jobner Bagh, WRF4+W2R, Station Rd, Shri Ram Colony, Sindhi Camp, Jaipur, Rajasthan 302006, India"
jai051,ChIJvV-Y9BC0bTkRRitfTY1I-ZM,FORTUNE,"22 Godam Cir, Durgadas Colony, C Scheme, Ashok Nagar, Jaipur, Rajasthan 302001, India"
jai052,ChIJCR6bCRixbTkRr-athVKxkmc,Hotel Dior Jaipur,"99 Govidpuri East,Karbala Chourha, near Jal mahal, Ramgarhmode, Karbala, Jaipur, Rajasthan 302002, India"
jai053,ChIJsxoYKfKzbTkRmXNR4I2cnA4,Anuraag Villa Hotel & Restaurant,"D-249, Devi Marg, Bani Park, Jaipur, Rajasthan 302016, India"
jai054,ChIJCRruQAe0bTkRkDerUTKfPOM,Hotel Om Tower,"HOTEL OM TOWER, Mirza Ismail Rd, Gopalbari, Jaipur, Rajasthan 302001, India"
jai055,ChIJddIBIPqzbTkRZ2SlWTTl2Gk,Nahar Singh Haveli,"46, Kanti Nagar, Sindhi Camp, Jaipur, Rajasthan 302006, India"
jai056,ChIJ_zBgM_izbTkREdXXZl7chbw,Vesta Maurya Palace,"S-35A, Arvind Marg, near Mirza Ismail Road, Panch Batti, C Scheme, Ashok Nagar, Jaipur, Rajasthan 302001, India"
jai057,ChIJA7NkRfizbTkRkvGyyBvF7Tg,Super Capital O Hotel Swastika,"Polo Victory Cinema, Tiwari Ji ki Bagichi, Sindhi Camp, Jaipur, Rajasthan 302001, India"
jai058,ChIJNwROQvGzbTkRacqyCG8mMcs,Hotel H R Palace,"D 157/A, Kabir Marg, Bani Park, Jaipur, Rajasthan 302016, India"
jai059,ChIJM6YmFFGzbTkR5uQGCzmFSZI,Hotel The Shyam,"Plot No.11, Motilal Atal Rd, next to India Bank, opp. GANPATI PLAZA, Sindhi Camp, Jaipur, Rajasthan 302001, India"
jai060,ChIJo1e2uFKxbTkRJoj-QgZ2CxI,Boby Mansion,"House No. - 232-A, Between Shop No. 104 & 105, Kishan Pole Bazar, Inside Ajmeri Gate, Kishanpole Bazar, Chandpole Bazar, Chandpole, Chandpol, Jaipur, Rajasthan 302001, India"
jai061,ChIJxQqXeB-0bTkRHId_W2Lvng4,"Rambagh Palace, Jaipur","Bhawani Singh Rd, Rambagh, Jaipur, Rajasthan 302005, India"
jai062,ChIJXYcrGgi2bTkRD9QZJx7VX6M,The Lalit Jaipur,"Jawahar Circle 2B & 2C, near Jagatpura Road, Saraswati Nagar Extension, Chainpura, Malviya Nagar, Jaipur, Rajasthan 302017, India"
jai063,ChIJVUiZSfuzbTkR2YgAeZsdb8s,"Lemon Tree Premier, Jaipur","Nirwan Marg, behind Inox Cinema, Sindhi Colony, Bani Park, Jaipur, Rajasthan 302016, India"
jai064,ChIJHbCnXj7JbTkRuTRl8yLB0YM,Hotel Grand Lotus Inn,"Lotus road, Mahal Rd, nearby Ashadeep building, opposite Akshay Patra temple, Jagatpura, Jaipur, Rajasthan 302017, India"
jai065,ChIJ41HjO_azbTkRxrz9eTU_jyg,"ITC Rajputana, a Luxury Collection Hotel, Jaipur","Palace Road, Gopalbari, Jaipur, Rajasthan 302006, India"
jai066,ChIJW2vB5ui3bTkRc4aeldISZvQ,Golden Tulip Jaipur,"Mirza Ismail Rd, opposite GPO, behind Jangid Bhawan, Panch Batti, C Scheme, Ashok Nagar, Jaipur, Rajasthan 302001, India"
jai067,ChIJR-x7nQO0bTkRaXFncpkGgUk,Shakun Hotels & Resorts,"D-28, Subhash Marg, Panch Batti, C Scheme, Ashok Nagar, Jaipur, Rajasthan 302001, India"
jai068,ChIJw6iBJaO2bTkRIP_ts-Dsogk,"Hotel Sukhvilas, Jaipur","24, Chetak Marg, near Moti Doongri Circle, near Raja Park, Gangawal Park, Adarsh Nagar, Jaipur, Rajasthan 302004, India"
jai069,ChIJ9d6ozg2lbTkRCMss-V0zYA0,The Leela Palace Jaipur,"Jaipur-Delhi Highway, NH 11, Kukas, Jaipur, Rajasthan 302038, India"
jai070,ChIJM2amkeW1bTkRia3J5eg9QO8,Jaipur Marriott Hotel,"Ashram Marg, near Jawahar Circle, Jai Jawan-2, Choti Chopad, Chandrakala Colony, Durgapura, Jaipur, Rajasthan 302015, India"
jai071,ChIJHZxsfXi2bTkRMsMoogz863s,"Red Fox by Lemon Tree Hotels, Jaipur","Jawahar Lal Nehru Marg, opp. MNIT College, Bajaj Nagar, Jaipur, Rajasthan 302017, India"
jai072,ChIJb6H5rXW0bTkRixXWyj_K75A,Hotel Moon Light Palace Jaipur,"S-34, near labour Court, opp. NBC Bearing Factory, Kamala Nehru Nagar, Shanti Nagar, Civil Lines, Jaipur, Rajasthan 302006, India"
jai073,ChIJ5xLjXDqxbTkR3uawjpcPFx0,Hotel Jaipur Heritage,"Police Station, Main, Amer Rd, behind Badrinath Temple, opp. Brahampuri, Govind Nagar East, Brahampuri, Jaipur, Rajasthan 302002, India"
jai074,ChIJczUCRO-1bTkRpZ6wbHTQtTQ,"Radisson Blu Hotel, Jaipur","Plots No. 5 and 6, Airport Plaza, Tonk Rd, Jai Jawan-2, Choti Chopad, Chandrakala Colony, Durgapura, Jaipur, Rajasthan 302018, India"
jai075,ChIJ37xKjKu0bTkRwH64z03QRF0,Jaipur Bagh,"126, Gandhipath West, Road, Lalarpura, Jaipur, Rajasthan 302021, India"
jai076,ChIJD2_OxBG0bTkRVNcylRKDq7M,Rajmahal Palace RAAS Jaipur,"Sardar Patel Marg, Shivaji Nagar, Jaipur, Rajasthan 302001, India"
jai077,ChIJHeln_fqzbTkRjGqU7W08iJI,Jaipur Inn,"B-17, Shiv Marg, Banipark, Kanti Nagar, Bani Park, Jaipur, Rajasthan 302016, India"
jai078,ChIJe-sb8XTJbTkRxljvARXEBNU,InterContinental Jaipur Tonk Road by IHG,"Tonk Rd, Sitapura Industrial Area, Sitapura, Jaipur, Rajasthan 302022, India"
jai079,ChIJw4HX4RC0bTkRy5w87yNu7mI,"Holiday Inn Jaipur City Centre, an IHG Hotel","Commercial Plot, No 1, Sardar Patel Marg, Shivaji Nagar, Jaipur, Rajasthan 302001, India"
jai080,ChIJvx8uaJy3bTkRjeNuvRMqPp4,"The Oberoi Rajvilas, Jaipur","Babaji Ka Modh, Goner Rd, Jagdish Colony, Prem Nagar, Jaipur, Rajasthan 302031, India"
jai081,ChIJrff-Z6q2bTkRmvZvKTgqeUo,Leisure Inn Grand Chanakya,"Kashi Bhawan, 4 A-B, Mirza Ismail Rd, Panch Batti, Jayanti Market, Pink City, Jaipur, Rajasthan 302001, India"
jai082,ChIJYcSphfezbTkRtBGY76Zr-UY,Hotel Jaipur Central,"6 D, 6 D, Station Rd, Kanti Nagar, Bani Park, Jaipur, Rajasthan 302001, India"
jai083,ChIJxw1FkDhLbDkR1qHrWffC-Zk,ClarksInn Suites Jaipur,"Govind Vihar Prime, Plot no 14, Ajmer Rd, Bhakrota, Jaipur, Rajasthan 302026, India"
jai084,ChIJN5Qmw-i1bTkR6oc9YXsbvTM,Hotel Royal Orchid Jaipur,"Near, Tonk Rd, opposite to BSNL Office, Shreeji Nagar, Surya Nagar, Durgapura, Jaipur, Rajasthan 302018, India"
jai085,ChIJ7RkuaG-1bTkRBadoTcQZ5TI,Hotel Metro Inn,"Plot No. 9 opp. ITC Rajputana Sheraton Fateh Singh Market, Gopalbari, Jaipur, Rajasthan 302006, India"
jai086,ChIJfyfnAkywbTkRhYN1rdDWA7Q,Hotel Clarks Amer,"Clarks Amer Hotel, Jawahar Lal Nehru Marg, opposite FORTIS ESCORTS HOSPITAL, Lal Bahadur Nagar, Chandrakala Colony, Durgapura, Jaipur, Rajasthan 302018, India"
jai087,ChIJx5YFvyvJbTkRpQdT2o6GUcA,Novotel Jaipur Convention Centre,"Nh 12, Tonk Rd, Sitapura Industrial Area, Sitapura, Jaipur, Rajasthan 302022, India"
jai088,ChIJu-4aoC-1bTkRfpXnfRCRrfs,Sunday Hotel Jaipur,"MGF Metropolitan Mall, 22 Godam Cir, Durgadas Colony, C Scheme, Ashok Nagar, Jaipur, Rajasthan 302001, India"
jai089,ChIJPRuWhqW2bTkRaMx5S80BHfA,Lords Plaza Jaipur,"Suchna Kendra, Sawai Ram Singh Rd, near Jaipur, Dusadon Ka Bagh, Sangram Colony, Ashok Nagar, Jaipur, Rajasthan 302001, India"
jai090,ChIJpZ1Z5nuzbTkRQjkLCCLauxg,Hotel Lakhdatar Palace - Best Hotel in Jaipur | 3 Star Hotel in Jaipur,"Near by Railway station 75, dharmashala ke piche, Barodia Basti, Barodia Scheme, Gopalbari, Jaipur, Rajasthan 302006, India"
jai091,ChIJvzNf2NG1bTkRDJPqaLZczr4,"Four Points by Sheraton Jaipur, City Square","City Square, Tonk Rd, Kirti Nagar, Vasundhara Colony, Gopal Pura Mode, Jaipur, Rajasthan 302018, India"
jai092,ChIJLSc5-wSxbTkRmz09fpWafr8,Hotel The Gold Palace & Resorts,"8th Mile, Jaipur Road, Jaipur, Kookas, Rajasthan 302038, India"
jai093,ChIJ26ucfzyxbTkRiA27fWCH8i4,The Raj Palace by Small Luxury Hotels of The World,"The Raj Palace, Jorawar Singh Gate, Amer Rd, Chokdi Gangapol, Jaipur, Rajasthan 302002, India"
jai094,ChIJZXkUdP-zbTkRV0-73h8biPo,Hotel Arya Niwas,"Sansar Chandra Rd, behind Amber Tower, Jalupura, Jaipur, Rajasthan 302001, India"
jai095,ChIJjc6LAPyzbTkRg9Q6CZ7Ysbs,Laxmi Palace Heritage Boutique Hotel,"D-194, Jagdish Marg, behind Sindhi Camp, Kanti Nagar, Bani Park, Jaipur, Rajasthan 302006, India"
jai096,ChIJRb544jCxbTkRxog-ltfNj7o,Samode Haveli,"Gangapole Road Near, Jorawar Singh Gate, Gangapole, Jaipur, Rajasthan 302002, India"
jai097,ChIJg2htbe-zbTkR1RiF7M3xhx8,"Zone by The Park Hotel, Jaipur","D-65A, Madho Singh Rd, Sindhi Colony, Bani Park, Jaipur, Rajasthan 302016, India"
jai098,ChIJt2HAY8O2bTkR23z0QXper3U,Ramada by Wyndham Jaipur,"Govind Marg, Raja Park, Jaipur, Rajasthan 302004, India"
jai099,ChIJa7OQqmK3bTkRT9QSCny4Ags,Click Hotel Jaipur,"Plot No: 549, Nr. LBS College of Pharmacy, Raja Park, Jaipur, Rajasthan 302004, India"
jai100,ChIJKdRsF9C1bTkRyjcw6CO-mvM,Pride Amber Vilas Resort & Convention Centre,"Vatika Mod, 12 Mile, Tonk Rd, Sitapura Industrial Area, Sitapura, Jaipur, Rajasthan 303905, India"
jai101,ChIJ0ZENvBC0bTkR-YKMUQn0SLs,Blue Beds Jaipur,"First Floor, B-16, Bhawani Singh Rd, Durgadas Colony, C Scheme, Ashok Nagar, Jaipur, Rajasthan 302001, India"
jai102,ChIJI6l0M_izbTkRWqzrGk7jXo0,Hotel Arco Palace Jaipur,"Walking, Bus Stand, A-52, 53, Station Rd, Opposite Metro Station, Vivek Nagar, Kanti Nagar, Sindhi Camp, Jaipur, Rajasthan 302006, India"
jai103,ChIJG9_VoRy0bTkRPztag-IhVME,Hotel Kalyan,"Hathroi Fort, Ajmer Rd, Hathroi, Jaipur, Rajasthan 302001, India"
jai104,ChIJMR5d2vazbTkRCyxPgkVgARk,Hotel Golden Heritage,"A3,H2, Sunder Path, behind Crystal Mall, Bani Park, Jaipur, Rajasthan 302006, India"
jai105,ChIJPSmQOADPbTkRImR4ChYR6lc,Anantara Jewel Bagh Jaipur Hotel,"Tonk Rd, Bilwa, Sitapura, Jaipur, Manpur Nagalya, Rajasthan 302022, India"
jai106,ChIJfcEwMoK1bTkRY5VIQa6Wfek,Dileep Kothi - A Royal Boutique Luxury Suites Jaipur,"89, Dhuleshwar Garden, Sardar Patel Marg, Panch Batti, C Scheme, Jaipur, Rajasthan 302001, India"
jai107,ChIJEVCBkEi3bTkRd3wcB-puwqA,"Taj Devi Ratn Resort & Spa, Jaipur","Ballupura Farms, No. 8 & 9, Agra Road, Jamdoli, Balloopura, Jaipur, Rajasthan 302031, India"
jai108,ChIJlXV_cRK1bTkRXycad_oEWqg,Hyatt Regency Jaipur Mansarovar,"Iskcon Rd, Mansarovar, Jaipur, Rajasthan 302020, India"
jai109,ChIJ4f5ISZy2bTkR_x3gAjbG66s,Royal Heritage Haveli Jaipur,"Plot No. 116 & 117, Near Khatipura Tiraya, Khatipura, Jaipur, Rajasthan 302012, India"
jai110,ChIJ4Wb7_ze3bTkRwWjyX_hljWc,Hyatt Place Jaipur Malviya Nagar,"Apex Cir, Jhalana Gram, Malviya Nagar, Jaipur, Rajasthan 302017, India"
jai111,ChIJhRQ9si-0bTkRkZVLw87ujsA,"Sarovar Premiere, Jaipur","Sarovar Premiere, Sahakar Marg, Tonk Road, Lalkothi, Jaipur, Rajasthan 302015, India"
jai112,ChIJizHha_ezbTkRDodD9xr-NiQ,Fairfield by Marriott Jaipur,"A, 28/C/3, Sawai Jai Singh Hwy, Kanti Nagar, Bani Park, Jaipur, Rajasthan 302006, India"
jai113,ChIJO8Xxg2ivbTkRTMMofiyzU9Q,The Vijayran Palace by Royal Quest Resorts,"THE VIJAYRAN PALACE, NH-8, KACHERA WALA, Kukas, Jaipur, Rajasthan 303805, India"
jai114,ChIJ37PF3Uu1bTkRwZL8OU4eGY8,Holiday Inn Express & Suites Jaipur Gopalpura by IHG,"Plot Number 21-22-23-37-38, Karoli Bagh, Shanthi Nagar, Gurjar Ki Thadi, Jaipur, Rajasthan 302019, India"
jai115,ChIJsS5EX76tbTkRI4TyVTBobCg,UMAID FARM RESORT-A LEGACY VINTAGE STAY IN JAIPUR,"C/O Geetanjali Farm Khasra No. 502 Near Rajawas Bus Stand Rajawas, Sikar Rd, Jaipur, Nangal Siras, Rajasthan 302013, India"
jai116,ChIJU8IomLJLbDkR0Et8JAXXV0I,The Palace By Park Jewels Hotels And Resorts,"Ajmer-Jaipur Expy, Narsinghpura, Jaipur, Ramchandpura, Rajasthan 302026, India"
jai117,ChIJt2aHEVy1bTkRohCjHTzlqXk,"The Fern Habitat, Jaipur","Shyam Nagar, Ajmer Road, Sodala Jaipur 302 019, Sodala, Jaipur, Rajasthan 302019, India"
jai118,ChIJGfQEX27JbTkRKjS2ukHKh3k,"Chokhi Dhani, Jaipur","12 Miles Tonk Road Via, Chokhi Dhani, Sitapura, Vatika, Jaipur, Rajasthan 303905, India"
jai119,ChIJi_FwC7GwbTkRcfwOBUbFl5s,Heiwa Heaven - Luxury Destination Wedding Resort,"Jamdoli Chauraha To Jaisinghpura Khor Road, Agra Rd, near Keshav Vidyapeeth, Jaipur, Rajasthan 302027, India"
jai120,ChIJw3lKkn2zbTkRlaN929rh2Bg,Sarovar Portico Jaipur,"Plot Number 90, Prince road Off Queens Road, Bhan Nagar, B, Vaishali Nagar, Jaipur, Rajasthan 302021, India"
jai121,ChIJdUEbon23bTkRpKApSGa98Io,"The Fern Residency, Jaipur","A-13, Govind Marg, near पिंक स्क्वायर मॉल, Janata Colony, Jaipur, Rajasthan 302004, India"
jai122,ChIJT3XWuai2bTkRWtOg4q6i9yw,Diggi Palace – A Heritage Hotel,"Diggi House , Shivaji Marg, Sawai Ram Singh Rd, Panch Batti, C Scheme, Ashok Nagar, Jaipur, Rajasthan 302004, India"
jai123,ChIJS-93c4lJbDkR9vIDUCguwwo,NEST JAIPUR LUXURY HOTELS AND RESORTS,"Near Bagru Toll Plaza, Bagru khurd, Ajmer Road, Jaipur, Bagru Khurd, Rajasthan 302042, India"
jai124,ChIJsyKs3_WzbTkRH9FuSFbMc4w,"Sheesh Mahal at ITC Rajputana, Jaipur","Palace Road, Gopalbari, Jaipur, Rajasthan 302006, India"
jai125,ChIJxagYq_S1bTkRmd3sBemfSxM,"Brij Nest, Jaipur | An All Suite Boutique Hotel","Jawahar Lal Nehru Marg, opposite to Fortis Hospital, Lal Bahadur Nagar, Chandrakala Colony, Mata colony, Jaipur, Rajasthan 302017, India"
jai126,ChIJsawzQwq2bTkRSXAt13l5_hA,Hotel De Nada-A Luxury Stay,"9/C, Girdhar Marg, near Fortis Hospital, Siddharth Nagar, Sector 9, Malviya Nagar, Jaipur, Rajasthan 302017, India"
jai127,ChIJIx9XHr22bTkR-uWHZs4DS6g,Suryaa Villa - A Boutique Heritage Hotel,"C, Peelwa Garden, ANAND PURI, 2, Moti Doongri Rd, Anand Puri, Bees Dukan, Adarsh Nagar, Jaipur, Rajasthan 302004, India"
jai128,ChIJMSZ9DRexbTkRhjLx0zReUwg,Club-Mahindra-Resort-Jaipur-Rajasthan,"Golimar-Garden, Plot-no.1, Amer Rd, near Ramgarh-Mod, Kagdiwara, Brahampuri, Jaipur, Rajasthan 302002, India"
jai129,ChIJH02UYMWybTkRSiLyu6pxgCM,"The Fern An Ecotel Hotel, Jaipur","Airport Plaza, Plot No. 3, Tonk Rd, Chandrakala Colony, Durgapura, Jaipur, Rajasthan 302018, India"
jai130,ChIJ61BEmfGzbTkRERSYD7d_Dc8,WelcomHeritage Traditional Haveli,"AC-4-C, Gayatri Marg, Sawai Jai Singh Hwy, Bani Park, Jaipur, Rajasthan 302016, India"
jai131,ChIJ-WSbPS2zbTkRhEby6Rnu0so,Regenta Place Jaipur,"133, Sirsi Rd, opp. Alankar PG College, Mahadev Nagar, Kanakpura, Jaipur, Rajasthan 302034, India"
jai132,ChIJab4ILJe1bTkRkpy65wFX_w8,"Sapphire World Hotel | Hotel in Mansarovar, Jaipur","B, plot no 62/ 63 , pillar no 7, Uday nagar, 19, Ganesh Nagar-B, Mohan Nagar, Mohru Nagar, Mansarovar, Jaipur, Rajasthan 302020, India"
jai133,ChIJj2slduuzbTkRYq6v5nvI_3s,HOTEL OM PALACE,"Hotel om palace A-14 sain colony opp railway station small line, Gopalbari, Jaipur, Rajasthan 302006, India"
jai134,ChIJE7D48PuzbTkRSCl2kXO8erc,Hotel Mahadev Villa,"Trimurti Apna Angan, Bhrigu Marg, Banipark, Part II, Sindhi Camp, Jaipur, Rajasthan 302016, India"
jai135,ChIJJd1h6_azbTkRv_PhnfFfVc8,Hotel Classic Inn Jaipur,"Plot No 96, Kabir Marg, near Railway Station, Barodia Scheme, Bani Park, Jaipur, Rajasthan 302006, India"
jai136,ChIJtWRzhbqzbTkRH0vwh5SbiMo,Khandela Haveli - a Boutique Heritage Hotel,"D 219 A, Bhaskar Marg, Sindhi Colony, Bani Park, Jaipur, Rajasthan 302016, India"
jai137,ChIJ6f7AYvizbTkRB_1GAJ76iiY,Atithi Guest House,"No 1, Park House Scheme, opposite All India Radio, Sindhi Camp, Jaipur, Rajasthan 302001, India"
jai138,ChIJFWDLpPWzbTkRMwAf3kwFlUo,Satkar Hotel near railway station,"187, 187, near Railway Station, Barodia Scheme, Bani Park, Jaipur, Rajasthan 302006, India"
jai139,ChIJwaT1mNy2bTkRkpo8rHaSaWg,Broadway Inn,"Near, Transport Nagar Flyover, opposite Sethi Colony, Sethi Colony, Jaipur, Rajasthan 302003, India"
jai140,ChIJmQFG4b2zbTkRBNGXIOiCFQ8,Townhouse Vaishali Nagar Jaipur Formerly Pentagon Boutique Hotel,"2nd,3rd&4th floor, Shivraj Niketan, Plot no 74, Gautam Marg, Gom Defence Colony, Vaishali Nagar, Jaipur, Rajasthan 302021, India"
jai141,ChIJjTlspy61bTkRrZbjkcxpZuQ,Hotel Ratangarh Palace,"Plot number 56, Hathroi Fort, Harikishan Somani Marg, near Banipark, Gopalbari, Jaipur, Rajasthan 302001, India"
jai142,ChIJjUw49n2zbTkRi7YafKVTNmM,Hotel Pink Palace - A Boutique Heritage Hotel,"Aghwani House, A-1, Vanasthali Marg, opp. Central Bus Stand, Ram Nagar Colony, Shri Ram Colony, Sindhi Camp, Jaipur, Rajasthan 302001, India"
jai143,ChIJtUTIFnK0bTkRgoPie3ECx0c,Zostel Jaipur,"First Floor, ICICI Bank Building, 85-A, Rajamal Ka Talab Rd, opposite Tourist Police Station, Chandi Ki Taksal, Pink City, Jaipur, Rajasthan 302002, India"
jai144,ChIJwwHVFg2zbTkRM3dBBRWAyqo,Backpackers Villa Jaipur,"602, 7c, Gopinath Marg, Jalupura, Jaipur, Rajasthan 302001, India"
jai145,ChIJjYdbdu2zbTkRFkloVob0wfk,Hotel Raas Palace,"10 Fateh Singh Market Opp ITC Rajputana Sheraton, Station Rd, Gopalbari, Jaipur, Rajasthan 302006, India"
jai146,ChIJ0UwP6fuzbTkRemY4_6mI-60,Hotel Life Inn.,"Plot No. 5, Jhotwara Rd, opposite Chamatkareshwar Mandir, near Space Cinema, Sindhi Colony, Bani Park, Jaipur, Rajasthan 302016, India"
jai147,ChIJVXOWXOWzbTkRsW-cuzPM3sU,Hotel Goyal Palace,"Subash Nagar , Opposite Krishna Kripa Complex, Subash Nagar Shopping Centre, Subhash Nagar Rd, Subash Nagar, Shastri Nagar, Jaipur, Rajasthan 302016, India"
jai148,ChIJ73jUjpO1bTkRnf7bN3oLayc,"FabHotel The White Moon - Hotel in Shyam Nagar, Jaipur","12, KIRTI NAGAR, Shyam Nagar, Jaipur, Rajasthan 302019, India"
jai149,ChIJz4DVGFS1bTkRhOLNU79heAw,Hotel The Rajmani,"B18, Park Avenue Road, Jawahar Lal Nehru Marg, D-Block, Malviya Nagar, Jaipur, Rajasthan 302017, India"
jai150,ChIJB9SWUpS2bTkRlwB8fKIKRd8,Hotel Dodas Palace,"Lane No. 2, Gali Number 2, Raja Park, Jaipur, Rajasthan 302004, India"
jai151,ChIJ28V-4gm0bTkR2g7lnoVfrQM,Hotel Sagun,"Fateh Singh Market, A-4, opposite Railway Post Office, Gopalbari, Jaipur, Rajasthan 302006, India"
jai152,ChIJd3hpI_CzbTkRE8etG3U1Fms,Blue King,"D-38/B, Madho Singh Rd, Govind Nagar East, Bani Park, Jaipur, Rajasthan 302016, India"
jai153,ChIJxbkUBwC0bTkRY-ZpVcbcWgw,Hotel Apoorva Deluxe Jaipur,"C-9, Main Jalupura Link Road, Mirza Ismail Rd, near Hotel Golden Tulip Essential, Jayanti Market, New Colony, Jaipur, Rajasthan 302001, India"
jai154,ChIJgx5Z0ge0bTkRu0LcU5o1mYg,Chitra Katha - A Story Per Stay,"60 Hathroi Fort, Hari Kishan Somani Marg, Ajmer Rd, Hathroi, Jaipur, Rajasthan 302001, India"
jai155,ChIJjWFyxQi0bTkRv7DQZBfbrEc,Lal Cottage Jaipur,"Devi Niketan Compound, 35 Lal, Ajmer Rd, Panch Batti, Mission Compound, Jaipur, Rajasthan 302001, India"
jai156,ChIJzcnXePGzbTkR64rrwwrmWTo,Hotel Milestone 251,"D-251, Devi Marg, Bani Park, Jaipur, Rajasthan 302016, India"
jai157,ChIJrabzefGzbTkRUWxxqHhRnNA,Hotel The Orion Jaipur,"AD-8A, Devi Marg, Sen Colony, Bani Park, Jaipur, Rajasthan 302016, India"
jai158,ChIJ20MXSFCzbTkRxq3ByjgmZg8,Jaipur Marigold Homestay,"77, Sirsi Rd, Mangal Nagar, Panchyawala, Jaipur, Rajasthan 302034, India"
